kdqG4fXAK64zdrqN8;54;122.78333333333333;2.2737654320987652;51.0;60.0;69.0;62.0;69.0;58.0;62.0;81.0;;;;Künstliche Intelligenz sorgt für die Digitalisierung. Durch das Deep Learning lernen sie Dinge objektiv zu bewerten, also wird menschliches Denken auf Computer übertragen. Dazu gehören Roboter, autonomes Fahren, Computertomographie. Viele sind gegen die Künstliche Intelligenz (Roboter), da sie der Meinung sind, dass sie keine Entscheidungen treffen sollten. ;FALSE;FALSE;2;0;2;5.0;5.0;4.0;Die KI behandelt das maschinelle Lernen und die Automatisierung intelligenten Verhaltens. Die KI nimmt uns Menschen bestimmte Arbeiten ab, wie z.B. im industriellen Bereich.;FALSE;3;0;0;4.0;5.0;3.0;Es ist eine Art Training, bei dem KIs Wissen und Erfahrung erlernen, mit Hilfe von Beispielen. ;FALSE;1;0;0;4.0;4.0;4.0;Maschinen sind dadurch in der Lage Probleme zu lösen und lernen mit Mustern und Daten immer mehr dazu. ;FALSE;1;0;0;5.0;5.0;4.0;;;;;;;;;;Dann denke ich würden die Seehunde nicht als Hunde erkannt werden, weil sie nicht die Eigenschaften eines Hundes haben.;;;;;5.0;5.0;5.0;[True, True, False, True];[True, False, True, False];[False, True, True, False];[False, True, True, True, False, False, True];[True, False, True];[True, True, False, True, False, False, True, False, True];[False, True, True];[False, True, True, False];[True, False];[False, True];[False, True];[True, True];[True, False, True];[False, True];[True, False, True, True, False, True, False, False];[True, True, False];;;;;;;;;;;qFEyvypMn4sAwLwtc
Absyuhryq96KZL2Cs;15;63.15;4.21;89.0;96.0;;;;33.0;;;;;;<h3>Die Künstliche Intelligenz ist menschliches Lernen und denken, welches man auf dem Computer übermittelt und dieser dann technisch umsetzt.</h3><br>;FALSE;FALSE;1;0;0;4.0;4.0;5.0;- KI wird inn der Zukunft in autos sein<ul><li>vereinfacht den Menschen das Leben </li><li>lernt durch seine Fehler</li><li>Wird auch später in anderen Fachbereichen auftreten</li></ul>;FALSE;2;0;0;3.0;3.0;4.0;;;;;;;;;;;;;;;;;;;;;;;;;;;;;;;;;;[False, True, True, True];[];[True, False, False, True];[False, True, False, True, True, False, False];[True, True, False];[];[];[];[];[];[];[];[];[];[];[];;;;;;;;;;;qFEyvypMn4sAwLwtc
j3AkifkKRR3t3NeoT;27;105.81666666666666;3.919135802469136;84.0;91.0;;82.0;;100.0;;;;;;KI kann man auch als menschliches Lernen bezeichnen. In Zukunft soll KI in Autos, aber auch als Roboter als Haushaltshelfer ein fester Bestandteil unseres Alltags sein. Künstliche Intelligenz will man in Zukunft auch in der Medizin nutzen. Dort soll es dann Dinge wie Muster erkennen, wo Ärtze nichts anfangen können. KI hat auch schlechte Seiten. Wenn zukünftig mehr KI genutzt wird, dann fallen die Zahlen der Arbeitsplätze. ;FALSE;FALSE;2;0;0;4.0;4.0;5.0;Es gibt zwei Arten von KI. Einmal die spezifische und die allgemeine. Die spezifische KI ist trainiert in einem bestimmten Bereich zu arbeiten. Die allgemeine KI kann viel mehr Dinge gut und positiv in verschiedenen Bereichen erbringen. KI nutzt man z.B. bei Websiten, die deinen Feed nach deinem Geschmack personalisieren. Außerdem kann KI Dinge durch ihr Aussehen erkennen. KI lernt aus Erfahrung.;FALSE;5;0;0;5.0;5.0;4.0;Bei maschinellem Lernen werden dem Computer viele Bilder eines Begriffs gezeigt wie zum Beispiel ganz viele Hundebilder. Dort lernt der Computer, was an den vielen Bildern so ähnlich ist und kennzeichnet dies als Eigenschaft. Das heißt, dass wenn man viele Hundebilder zeigt, dass der Computer sich dann theoretisch merkt, dass ein Hund immer eine Schnauze hat.;FALSE;2;0;0;4.0;5.0;3.0;;;;;;;;;;;;;;;;;;;;;;;;;;[False, True, False, True];[];[False, True, True, False];[False, True, False, True, True, False, True];[True, False, True];[];[];[False, False, True, True];[False, True];[False, True];[False, True];[];[];[];[];[];;;;;;;;;;;qFEyvypMn4sAwLwtc
XKrLvRHLaM7yDisR6;23;91.55;3.9804347826086954;100.0;59.0;;53.0;;52.0;;;;;;Künstliche Intelligenz (KI) ist ein weitreichender Zweig der Informatik, der sich mit dem Bau intelligenter Maschinen befasst, die Aufgaben ausführen können, die normalerweise menschliche Intelligenz erfordern. KI ist eine interdisziplinäre Wissenschaft mit mehreren Ansätzen, aber Fortschritte beim maschinellen Lernen und beim tiefen Lernen führen zu einer Verschiebung in praktisch allen Bereichen der Technologiebranche.<br>;FALSE;TRUE;0;0;0;5.0;5.0;4.0;"<pre class=""ql-syntax"" spellcheck=""false"">KI ist ein weitreichender Zweig der Informatik, der sich mit dem Bau intelligenter Maschinen befasst, die Aufgaben ausführen können. KI ist  Fortschritte beim maschinellen Lernen und beim tiefen Lernen führen zu einer Verschiebung in praktisch allen Bereichen der Technologiebranche. es variiert von Allgemeine KI und Spezifische KI.
</pre>";TRUE;0;0;0;4.0;5.0;4.0;"<pre class=""ql-syntax"" spellcheck=""false"">Ja, ich wusste, dass es verschiedene Arten von gibt &nbsp;maschinelle Lernen dass man zum Unterrichten von Technik verwendet werden, aber ich habe nur ein (Deep learning) tiefes Lernen gelernt und verstanden.
</pre><br>";FALSE;2;1;0;3.0;4.0;3.0;;;;;;;;;;;;;;;;;;;;;;;;;;[True, True, True, True];[];[True, False, True, True];[False, False, True, True, True, True, True];[True, True, True];[];[];[];[True, False];[True, False];[True, False];[];[];[False, True];[];[];;;;;;;;;;;qFEyvypMn4sAwLwtc
C2BW6tdii778v4RfL;35;84.81666666666666;2.4233333333333333;48.0;51.0;;59.0;;60.0;;;;;;Ich denke, dass KI z.B. In Form von Robotern auftreten kann und dir auf bestimmten Gebieten helfen, eine Entscheidung zu fällen, jedoch ist KI nicht in der Lage selbst Entscheidung zu fällen.;FALSE;FALSE;0;1;0;4.0;4.0;5.0;"<span style=""color: rgb(32, 33, 36);"">Die KI ist der Versuch, menschliches Lernen und Denken auf den Computer zu übertragen und ihm damit Intelligenz zu verleihen.</span>";FALSE;1;0;0;3.0;4.0;5.0;Maschinelles lernen bedeutet, dass man lernt, indem man Erfahrung sammelt;FALSE;0;1;0;3.0;5.0;3.0;;;;;;;;;;;;;;;;;;;;;;;;;;[True, True, False, True];[];[False, True, True, False];[False, True, True, False, True, False, False];[True, False, False];[];[False, True, True];[False, True, True, False];[True, False];[False, True];[False, True];[];[True, False, False];[];[];[];;;;;;;;;;;qFEyvypMn4sAwLwtc
3hiSwDCiw9HeyHg7f;66;70.36666666666666;1.066161616161616;100.0;86.0;86.0;65.0;88.0;100.0;98.0;96.0;100.0;26.0;88.0;Eine Künstliche Intelligenz ist ein Programm, welches sich durch Deeplearning und Daten selbst weiter entwickeln kann. ;FALSE;FALSE;1;0;0;4.0;5.0;4.0;Es gibt unterschiedliche arten von Künstlichen Inteligenzen. Die sogenannten spezifischen Künstliche Intelligenzen können Aufgaben nur in einem Bereich ausführen. Allgemeine Künstliche Intelligenzen können die Anforderungen in allen Bereichen erfüllen. ;FALSE;3;0;0;5.0;5.0;4.0;Maschinelles Lernen ist das verarbeiten van Daten um Gemeinsamkeiten zu bestimmen. ;FALSE;1;1;0;3.0;4.0;3.0;Maschinelles Lernen ist das Auslesen von Daten um in anwendungsfällen richtig entscheiden zu können.;FALSE;1;0;0;5.0;5.0;4.0;80.0;Eine Künstliche Intelligenz kann nur das machen worauf sie trainiert wurde. Die Szenarien aus Actionfilmen, wo Künstliche Intelligenzen die Herschafft über die Welt ergreifen sind zumindest zum Aktuellen Zeitpunkt nur Fantasien.;;;;;5.0;5.0;5.0;Da Hunde und Seehunde nur wenige Körperliche Ähnlichkeiten haben würden richtige Hunde nur in selten fällen  als Hund erkannt werden.;;;;;5.0;5.0;4.0;[False, True, False, True];[True, True, True, False];[False, True, True, False];[True, True, False, True, True, False, True];[True, False, True];[True, False, True, True, False, True, False, True, True];[False, True, False];[False, False, True, True];[True, False];[False, True];[False, True];[True, False];[True, False, True];[False, True];[True, False, True, False, True, True, True, True];[True, True, False];61.0;93.0;Wenn man das Programm zum ersten mal ausführt, dann ist ein Text nicht vollständig zu lesen, weil er hinter der Garage verschwindet. Wenn man bei der Aufgabe über das Clustering mit dem Beispiel der Filme einen Fehler macht und diesen Korrigieren möchte ist nur nach die Fragestellung zu sehen. Ohne sich die richtige Antwort gemerkt zu haben ist es nur durch raten möglich diese Frage richtig zu beantworten.;;;;;5.0;5.0;5.0;qFEyvypMn4sAwLwtc
MRSj5LqwWj6WSoj4E;18;76.48333333333333;4.249074074074074;96.0;88.0;;98.0;;66.0;;;;;;Eine Künstliche Intelligenz ist ein Programm der von verschiedenen Strukturen lernen kann. Die KI wird von den Menschen weiterhin verbessert so das sie ihre Aufgaben erledigen können. Sie werden zum Beispiel genutzt, um Menschen zu retten oder Sachen zu erkennen die Menschen nicht erkennen können und andere Dinge. Die Künstliche Intelligenz wurde erfunden, um das zu machen wo für die Menschen Schwierigkeiten oder eine große Gefahr haben.;FALSE;FALSE;0;0;1;4.0;5.0;4.0;KIs lernen durch Erfahrung und hat 2 Arten, das spezifische und allgemeine. Das spezifische sind nur bei einem Bereich sehr gut und das allgemeine Feeds in Apps. Heutzutage gibt es noch nicht künstliche Intelligenz die genauso schlau wie die Menschen sind.;FALSE;4;1;0;4.0;5.0;3.0;;;;;;;;;;;;;;;;;;;;;;;;;;;;;;;;;;[True, True, False, True];[];[True, True, False, False];[True, True, False, False, True, True, False];[False, False, True];[];[];[];[];[];[];[];[];[];[];[];;;;;;;;;;;qFEyvypMn4sAwLwtc
6bBwnX2mwAp2NAwNR;35;114.55;3.2728571428571427;77.0;68.0;;52.0;;100.0;;;;;;"Künstliche Intelligenz bedeutet, dass ein Roboter (bzw. eine Maschine) Verhalten nachahmen kann und sich selbst als Mensch verhalten kann. Auch kann eine Künstliche Intelligenz <strong>komplett selbstständig</strong> handeln, dies geschieht durch die sogenannte <strong>Automatisierung</strong>. Zum Beispiel werden Autos auf das sogenannte ""<strong>autonome Fahrsystem</strong>"" umgestellt, was so viel bedeutet, dass Autos komplett selbstständig fahren und in brenzlichen Situationen selbstständig handeln. ";FALSE;FALSE;2;1;0;5.0;5.0;4.0;KI (Künstliche Intelligenz) unterscheidet man in zwei Bereichen: Die spezifische KI und die allgemeine KI. Die spezifische KI weist menschenähnliche Intelligenz in einem kleinen Bereich vor (dies kann zum Beispiel ein Filter sein), sie kann aber auch die menschliche Intelligenz übertreffen (Computer Games). Die allgemeine KI weist menschenähnliche Intelligenz in einem großen Bereich vor, was so viel bedeutet, dass sie in mehreren und auch größeren Bereichen der menschlichen Intelligenz ähneln oder sogar übertreffen.<br>Eine KI lernt durch Erfahrung: Sie wird also trainiert. In Computer-Games hat sich die KI schon so weit entwickelt, dass sie die Besten E-Sportler übertreffen. Dies geschieht unter anderem dadurch, dass die KI selbstständig handeln kann.;FALSE;6;0;0;5.0;5.0;5.0;"Maschinelles Lernen bedeutet, dass eine KI trainiert (wird). Dies geschieht durch die ""Hereingabe"" von Daten. Die KI lernt dadurch dann, etwas zu erkennen und unterscheidet zum Beispiel unter ""Hund"" oder""Kein Hund"". ";FALSE;2;0;0;5.0;5.0;4.0;;;;;;;;;;;;;;;;;;;;;;;;;;[True, True, False, True];[];[False, True, True, False];[True, True, True, True, True, False, True];[True, False, True];[];[False, True, False];[False, True, True, True];[False, True];[True, False];[False, True];[];[True, False, True];[];[];[];;;;;;;;;;;qFEyvypMn4sAwLwtc
aiaYpPdYWJKb2hs7J;37;40.21666666666667;1.086936936936937;52.0;84.0;;82.0;;100.0;;;;;;Künstliche Intelligenz sind Menschen ähnlich aber keine Menschen. So genannte Roboter. Roboter sind da um Menschen zu helfen z.B. in Fabriken oder so.;FALSE;FALSE;0;1;2;3.0;4.0;3.0;KI sind Roboter die auf bestimmte Beriche spezialisiert sind und dann Menschen helfen.;FALSE;0;1;0;3.0;4.0;3.0;Maschinelles Lernen ist wenn ein Computer etwas abertausendmal wieder holt Mund von seinen Ergebnissen lernt.;FALSE;1;0;0;4.0;2.0;4.0;;;;;;;;;;;;;;;;;;Die KI würde Seehunde als Hunde erkennen und Hunde würde er nicht erkennen;;;;;4.0;5.0;4.0;[True, True, False, True];[];[False, False, True, False];[True, True, False, True, True, False, False];[True, False, True];[];[False, True, False];[False, True, True, True];[False, True];[False, True];[False, True];[];[True, False, True];[];[];[True, True, False];;;;;;;;;;;qFEyvypMn4sAwLwtc
T4iugPHxim5gX8M4i;26;31.016666666666666;1.192948717948718;65.0;;;;;;;;74.0;59.0;34.0;es ist künstliche Intelligenz sien lernt desto mehr man ihr bei bringt ;FALSE;FALSE;0;0;1;5.0;5.0;5.0;;;;;;;;;;;;;;;;;;;;;;;;;60.0;sie können gut helfen werden trotzdem nicht alles übernehmen können dafür muss die technologie erstmal so weit sein .;;;;;5.0;5.0;5.0;;;;;;;;;[True, True, True, True];[];[];[];[True, False, True];[];[];[];[];[];[];[];[];[True, False];[];[];42.0;60.0;nichts ;;;;;5.0;5.0;5.0;GkQSJvPTRWsLnpyR9
jEu6xtqA4gGjdgqgm;46;53.46666666666667;1.1623188405797102;77.0;83.0;;28.0;;18.0;;;84.0;44.0;50.0;Künstliche Intelligenz kann gut aber auch schlecht sein, in der Pflege also zum Beispiel im Krankenhaus oder im Altenheim könnte es sehr hilfreich sein aber es wird den Menschen nie vollständig ersetzten ;FALSE;FALSE;0;0;1;5.0;5.0;5.0;kl heißt künstliche intelligenz ;FALSE;0;0;1;5.0;5.0;5.0;;TRUE;0;0;0;5.0;5.0;5.0;;;;;;;;;100.0;.<br>;;;;;5.0;5.0;5.0;;;;;;;;;[False, True, False, True];[];[True, True, False, True];[False, True, False, True, False, False, True];[False, True, False];[];[];[False, False, True, False];[True, False];[True, False];[True, False];[];[];[False, True];[];[];14.0;35.0;.<br>;;;;;5.0;5.0;5.0;GkQSJvPTRWsLnpyR9
iHYe2TGnR9zgGZ6zh;66;29.2;0.4424242424242424;100.0;100.0;100.0;100.0;67.0;100.0;100.0;67.0;1.0;100.0;1.0;jo;FALSE;TRUE;0;0;0;5.0;5.0;5.0;ja<br>;TRUE;0;0;0;5.0;5.0;5.0;lul;TRUE;0;0;0;5.0;5.0;5.0;Das die Maschiene durch Erfahrung lernt;FALSE;1;0;0;5.0;5.0;5.0;71.0;Das ich dagegen bin weil es auch so viele jahre ohne funktionirt hat mit welchem grund soll es jetzt soetwas geben.;;;;;5.0;5.0;5.0;sie würden nicht erkant werden;;;;;5.0;5.0;5.0;[False, True, True, True];[True, False, True, False];[False, False, True, False];[False, True, True, False, True, False, False];[False, True, False];[False, True, False, True, False, True, False, True, True];[False, False, True];[False, True, True, False];[True, False];[True, False];[True, False];[True, False];[False, True, False];[True, False];[False, True, False, True, True, False, True, False];[True, False, True];100.0;1.0;Diese schreib aufgarben sind langweilig.;;;;;5.0;5.0;5.0;GkQSJvPTRWsLnpyR9
hovj8Sfjv8G9Q2YxH;26;38.25;1.4711538461538463;76.0;;;;;;;;57.0;55.0;53.0;Ich denke Künstliche Intilligenz wird oft bei Robotern benutzt, besonders im Medizinischen bereicht spielt diese eine große rolle, sie findet vielleicht schneller Ursachen ür Krabnkheiten und bei Operationen ist sie viellicht auch eine große hilfe. Jedoch gibt es auch Negative aspekte, wie zum Beispiel Arbeitslosigkeit, wenn die Kl-Methode in Berufen eingesetzt wird, wobei man dann keine Menschen mehr braucht.;FALSE;FALSE;2;0;0;5.0;5.0;5.0;;;;;;;;;;;;;;;;;;;;;;;;;64.0;Kl ist etwas Poitives aber auch etwas Negatives, viele Jobs können aufs spiel gesetzt werden, wo man eigentlich gar keine Kl- Methode braucht, jedoch gibt es einiges, wobei es die Menschen stark unterstützt. Es erleichtert einigen Menschen das Leben, es bringt eine erleichterung für alle Arbeitenden mit sich, man sollte sich keine sorgen machen.;;;;;5.0;5.0;5.0;;;;;;;;;[False, False, True, True];[];[];[];[False, False, True];[];[];[];[];[];[];[];[];[False, True];[];[];61.0;75.0;Ich finde, man konnte etwas lernen, worüber man am anfang noch nicht so viel wusste, für manche können dies Informationen vielleicht im späteren leben noch wichtig und zu gebrauchen sein. ;;;;;5.0;5.0;5.0;GkQSJvPTRWsLnpyR9
YEmTft3BS22fdYdQi;42;45.18333333333333;1.0757936507936507;58.0;66.0;;76.0;;53.0;;;57.0;54.0;45.0;Meiner Meinung nach sind KI´s nichts schlechtes, da sie in vielen Jobs eine große Hilfe sein können wie z.B in der Medizin. Im alltag gibt es ja heute schon sprachassistenten wie z.B Alexa oder Google home die per Sprachsteuerung z.B das Licht anschalten oder den Fernseher was manches erleichtert, wie wenn man Vollbepackt mit Einkaufstüten oder Reise gepäck nach Hause kommt und keine Hand frei hat um das Licht anzuschalten ist ein Sprachassistent sehr Hilfreich.;FALSE;FALSE;1;0;1;5.0;5.0;5.0;Ki ist die Künstliche Inteligenz die heute schon in einigen sachen befindet wie Robotern, Computern oder Handys;FALSE;1;0;0;5.0;5.0;5.0;Das machinelle Lernen ist einfach ein algorythmus der auf dem Gerät programmiert ist.;FALSE;0;1;0;5.0;5.0;5.0;;;;;;;;;81.0;Es ist nicht alles schlecht an einem KI im gegenteil, KI können in der Medizin sehr behilflich sein z.B beim suchen eines Tumores. Sie können allerdings auch die Behandlung auf den Patienten abstimmen welcher der Patient dann nur noch zustimmen muss.KI können in vielen Jobs als unterstützung dienen, dennoch wäre es nicht all zu gut KI`s durch die Menschen zu ersetzten was aber auch komplett warscheinlich nicht passieren wird und vorallem nicht in allen Jobs.;;;;;5.0;5.0;5.0;;;;;;;;;[False, True, True, True];[];[False, True, True, False];[True, False, True, False, False, False, True];[True, True, False];[];[];[];[True, False];[False, True];[True, False];[];[];[False, True];[];[];44.0;67.0;Ich wüsste nicht was man verändern kann ;;;;;5.0;5.0;5.0;GkQSJvPTRWsLnpyR9
DK2rx5xPL6KCEobJE;47;41.61666666666667;0.8854609929078014;72.0;65.0;;50.0;;67.0;;;73.0;27.0;54.0;Es ist eine art computer der gewisse sachen lernen kann ;FALSE;FALSE;1;1;0;5.0;5.0;5.0;es gibt allgemeine und spezifische KIs. sie lernen durch Erfahrung es gibt keine KI die in allen bereichen so schlau ist wie ein mensch ;FALSE;3;0;0;5.0;5.0;5.0;keine ahnung ;TRUE;0;0;0;5.0;5.0;5.0;;;;;;;;;71.0;KI konnen den menschen echt helfen und auch arbeit abnehmen dazu müssen sie natürlich richtig funktionieren ;;;;;5.0;5.0;5.0;;;;;;;;;[True, False, False, True];[];[False, True, True, False];[True, True, False, False, True, True, False];[False, True, False];[];[];[True, True, True, False];[True, False];[True, False];[True, False];[];[];[False, True];[];[];67.0;69.0;ne ;;;;;5.0;5.0;5.0;GkQSJvPTRWsLnpyR9
TWes7DiBwCuCzS2px;24;39.53333333333333;1.6472222222222221;64.0;;;;;;;;38.0;49.0;33.0;Kpnstliche Intelligenz ist wenn man ihn viele Kompizierte fragen stellen kann und eine gute und konrete antwort bekomme. Es werden mehr Jobs von ihnen Übernommen ( halbwegs) und das sie die Krankheiten schneller und besser herausfinden und auch wissen was sie tuen müssen damit die Person schnell wieder Gesund wird.  ;FALSE;FALSE;1;1;0;5.0;5.0;5.0;;;;;;;;;;;;;;;;;;;;;;;;;65.0;ich würde sagen das ich es verstehen kann aber es auch viele Vorteile hat und man gucken kann was passiert. man kann sich natürlich mit den Thema auseinander setzten. ;;;;;5.0;5.0;5.0;;;;;;;;;[False, True, True, True];[];[];[];[];[];[];[];[];[];[];[];[];[False, True];[];[];54.0;59.0;es gibt nichts<br>;;;;;5.0;5.0;5.0;GkQSJvPTRWsLnpyR9
Fu8mnQdaA2GvmLZnb;23;29.2;1.2695652173913043;73.0;;;;;;;;46.0;60.0;55.0;Ich denke das es viele vorteile mit sich bringt wie zum beispiel die medizin zu verbesser oder bei operation riskien zu minmieren oder sogar komplett zuverhindern oder im Einzelhandel die Kasse schneller bedien oder die regale schneller und ordentlicher einzuräumen. Jedoch stehe ich etwas skeptisch dem Thema gegenüber, weil es zu vielen Arbeitslosen kommen könnte und ich denke das sie niemals soziale Arbeit übernehmen könnte, weil keine künstliche interlligenz diese werte vermitteln kann wie es menschen tun oder mensch das gefühl geben könnte die wie andere menschen es einem geben oder auch zeigen.;FALSE;FALSE;1;1;0;5.0;5.0;5.0;;;;;;;;;;;;;;;;;;;;;;;;;69.0;Ich würde der Person sagen das ich es nachvollziehen kann, das sie sich sorgen macht jedoch würde ich ihr auch die vorteile erklären.;;;;;5.0;5.0;5.0;;;;;;;;;[];[];[];[];[];[];[];[];[];[];[];[];[];[False, True];[];[];64.0;74.0;Es gab nichts wirklich was mir nicht gefallen hat. Aber ich denke das es für jüngere Schüler schnell unverständlich werden könnte.;;;;;5.0;5.0;5.0;GkQSJvPTRWsLnpyR9
Yss4MmFBusuAqSMaN;66;51.7;0.7833333333333333;62.0;87.0;56.0;50.0;54.0;94.0;52.0;58.0;74.0;43.0;54.0;künstliche intelligenz ist zB.: ein Robotter;FALSE;FALSE;0;1;0;5.0;5.0;5.0;sie lernen selbsständig ;FALSE;1;0;0;5.0;5.0;5.0;;;;;;;;;;;;;;;;;61.0;KI`s können denn Menschen bei gewissen dingen helfen ;;;;;5.0;5.0;5.0;ist ja richtig;;;;;5.0;5.0;5.0;[False, False, False, True];[False, True, False, False];[False, False, False, True];[False, True, False, True, False, False, False];[False, False, True];[False, False, False, False, False, False, False, True, False];[False, True, True];[False, False, True, False];[False, True];[True, False];[False, True];[False, True];[False, True, False];[False, True];[False, True, False, True, False, False, False, False];[True, False, False];87.0;68.0;alles gut ;;;;;5.0;5.0;5.0;GkQSJvPTRWsLnpyR9
JTE3T8c3SN6ehbrDQ;42;38.56666666666667;0.9182539682539683;54.0;40.0;;47.0;;75.0;;;83.0;44.0;70.0;Künstliche Intelligenz wird von Computer Systemen gesteuert. Sie merkt sich was sie machen soll und wendet dies dann beliebig oft an.;FALSE;FALSE;0;1;1;5.0;5.0;5.0;KI ist ein System welches Aufgaben übernehmen kann. Es gibt zwei Arten von KIs, allgemeine KI, die sich so wie ein Mensch verhält und spezifische KI die sich auf eine bestimmte Aufgabe konzentriert und diese ausführen kann.;FALSE;3;0;0;5.0;5.0;5.0;Weis ich nicht.;TRUE;0;0;0;5.0;5.0;5.0;;;;;;;;;55.0;Ich denke, dass die KI früher oder später sowieso viele Aufgaben übernehmen wird, da es vieles erleichtert. Ich kann verstehen, wenn man Angst davor hat aber ich denke, dass hintereher die Vorteile die Angst weg drücken werden.;;;;;5.0;5.0;5.0;;;;;;;;;[True, False, False, True];[];[False, False, True, False];[True, True, False, True, False, False, True];[True, False, True];[];[];[];[False, True];[False, True];[True, False];[];[];[False, True];[];[];36.0;86.0;Ich fand das Thema gut, allerdings weis ich nicht so recht wofür wir das machen.;;;;;5.0;5.0;5.0;GkQSJvPTRWsLnpyR9
Qmv6K9aQsAEKfHsK9;66;38.61666666666667;0.5851010101010101;69.0;100.0;31.0;100.0;74.0;100.0;100.0;69.0;100.0;87.0;97.0;Ich bin der Meinung das die KI eine menge Helfen kann ;FALSE;FALSE;0;0;1;5.0;5.0;5.0;Die KI ist eine Küstlich intiligentz ;FALSE;0;0;1;5.0;5.0;5.0;Ich weiß es noch nicht ;TRUE;0;0;0;5.0;5.0;5.0;Kein Plan ;TRUE;0;0;0;5.0;5.0;5.0;100.0;Ich würde sagen das die KI eine menge erleichtern kann aber nicht zur Spieonasche genutz werden sollte. ;;;;;5.0;5.0;5.0;Der Algurütmuss würde es nicht erkennen ;;;;;5.0;5.0;5.0;[True, True, False, True];[True, True, True, False];[True, False, False, False];[False, True, False, False, True, False, False];[True, True, False];[True, False, True, False, True, True, False, True, True];[False, True, True];[True, True, False, True];[False, True];[True, False];[True, False];[True, False];[False, False, True];[True, False];[False, False, True, True, True, False, True, False];[False, True, False];100.0;88.0;Es hat alles funktoniert  ;;;;;5.0;5.0;5.0;GkQSJvPTRWsLnpyR9
eSpxJKMm99HohczFv;66;42.766666666666666;0.647979797979798;58.0;81.0;38.0;52.0;36.0;85.0;77.0;50.0;78.0;57.0;49.0;Ich finde das KI Eine inteligenz ist die durch handeln und zuschauen dazu lernt wie es menschen machen;FALSE;FALSE;1;1;0;5.0;5.0;5.0;Eine KI ist eine künstlige inteligent die es in zwei bereichen gibt 1 allgemeine KI die in mehreren dingen gut ist2 spezifische KI die in kleinen beeichen besser ist;FALSE;2;0;0;5.0;5.0;5.0;maschienen lernen duch probieren;FALSE;0;1;0;5.0;5.0;5.0;Maschienen lernen;FALSE;0;0;1;5.0;5.0;5.0;70.0;Die Zukunft mit KI wird warscheinlich einfacher die menschen müssen weniger dinge machen aber es wird auch weniger arbeitzplätze für menschen geben;;;;;5.0;5.0;5.0;seehunde würden als hunde erkant werden und die richtigen hunde würden nicht erkannt werden;;;;;5.0;5.0;5.0;[True, True, False, True];[True, False, True, False];[False, True, False, True];[True, True, False, False, False, True, False];[True, True, False];[True, True, False, True, False, True, False, True, False];[False, True, True];[False, True, True, True];[False, True];[False, True];[True, False];[False, True];[False, True, True];[False, True];[False, False, False, False, False, False, False, False];[True, True, False];73.0;63.0;Alles gut wie es ist;;;;;5.0;5.0;5.0;GkQSJvPTRWsLnpyR9
gDspq39jnffCNv8E2;66;26.666666666666668;0.40404040404040403;18.0;100.0;100.0;100.0;24.0;100.0;30.0;37.0;100.0;32.0;86.0;kl ist gut;FALSE;FALSE;0;0;1;5.0;5.0;5.0;;;;;;5.0;5.0;5.0;ich weiß nocht nichts <br>;TRUE;0;0;0;5.0;5.0;5.0;keine arnung;TRUE;0;0;0;5.0;5.0;5.0;100.0;es gibt balt sowieso Kl also soll der sich nicht so anstellen ;;;;;5.0;5.0;5.0;seehunde würden als hunde erkannt werden und die richtigen hunde würden nicht als hund erkannt werden<br>;;;;;5.0;5.0;5.0;[True, False, True, False];[True, False, True, False];[False, True, True, False];[True, False, True, False, False, True, False];[True, False, True];[True, False, False, True, False, True, False, False, True];[False, True, False];[False, False, True, True];[True, False];[False, True];[True, False];[True, True];[False, True, False];[False, True];[True, False, True, True, False, True, True, True];[True, True, False];85.0;95.0;die funktionen sind alle super;;;;;5.0;5.0;5.0;GkQSJvPTRWsLnpyR9
