N62PxuFACsR6DuvBc;31;44.516666666666666;1.436021505376344;44.0;61.0;;;;45.0;;;57.0;56.0;52.0;;TRUE;;;;;;;;"<span style=""color: rgb(77, 81, 86);"">Künstliche Intelligenz ist ein Begriff für Anwendungen, bei denen Maschinen menschenähnliche Intelligenzleistungen erbringen. Dazu gehört auch das selbständige lernen, welches die Maschinen durch Erfahrungen generieren. Ich finde, die Unterschiede zwischen spezifischen und der allgemeinen KI sind sehr gut erklärt worden.</span>";FALSE;4;0;0;4.0;5.0;4.0;;;;;;;;;;;;;;;;;59.0;;;;;;;;;;;;;;;;;[False, True, True, True];[];[False, True, True, True];[True, True, True, False, True, False, False];[False, True, False];[];[];[];[];[];[];[];[];[False, True];[];[];100.0;75.0;;;;;;;;;hZ9Hi9DLZSm5JMbNm
Decqz7SuZcHMFsSAn;42;73.71666666666667;1.7551587301587301;52.0;80.0;;58.0;;70.0;;;73.0;32.0;47.0;;TRUE;;;;;;;;"Künstliche Intelligenzen werden so programmiert, dass sie ähnlich wie ein Menschen in bestimmten Aufgabenbereichen eigenständige Entscheidungen treffen können. Sie können ebenfalls lernen, diese geschieht über Erfahrung.Die bisherigen Künstlichen Intelligenzen gehören zu spezifischen KI, da sie bisher ,,nur"" in einem Aufgabenbereich die Intelligenz eines Menschen aufweisen. Eine KI, die der gesamten Intelligenz eines Menschen gleich kommt, also in mehreren Aufgabenbereichen, gibt es noch nicht.";FALSE;5;0;0;5.0;5.0;5.0;Maschinelles lernen, ist das Gewinnen von Wissen aus Erfahrung. KI bekommen in der Lernphase viele Beispiele, von dem was sie später einmal machen sollen. Sobald sie sich dann im Richtigen Einsatz befinden, können sie auf ihr Wissen welsches sie in der Lernphase durch Erfolge und Fehler gewonnen haben zu greifen. So  ist es möglich KI etwas beizubringen.  ;FALSE;2;0;0;5.0;5.0;5.0;;;;;;;;;74.0;;;;;;;;;;;;;;;;;[True, True, False, True];[];[False, True, True, False];[True, True, False, True, True, False, True];[True, True, False];[];[];[];[True, False];[False, True];[False, True];[];[];[False, True];[];[];79.0;99.0;;;;;;;;;hZ9Hi9DLZSm5JMbNm
tFtNEGEvAWMPxNKri;3;56.35;18.783333333333335;87.0;;;;;;;;;;;;;;;;;;;;;;;;;;;;;;;;;;;;;;;;;;;;;;;;;;;;;;;;;;;;;[];[];[];[];[];[];[];[];[];[];[];[];[];[];[];[];;;;;;;;;;;hZ9Hi9DLZSm5JMbNm
BHDJ6HWSM5MZo6YSJ;42;63.233333333333334;1.5055555555555555;64.0;79.0;;65.0;;77.0;;;68.0;16.0;63.0;KI ist die Technik der Zukunft. Mit der KI können wir vieles leichter machen, aber wir müssen auch aufpassen. Weil die KI kann auch vielen Menschen den Job kosten. Aber es werden auch wieder neue geschaffen. Also alles im allem finde ich die KI gut. Man kann viele Sachen wesentlich leichter bewältigen mit der KI;FALSE;FALSE;1;0;2;4.0;4.0;5.0;Eine KI ist selbst denkend. Es lernt selbst dazu. Zurzeit schaffen wir aber es nur das eine KI im ein Bereich gut ist( das wo sie programmiert wurde) und nicht das sie generell gut ist. Aber in diesen einen Bereich kann die KI sogar besser sein, als Menschen es je sein können.;FALSE;5;0;0;4.0;3.0;4.0;Viele Maschinen lernen dauerhaft, wie zum Beispiel der Algorithms der Werbung schaltet.;FALSE;0;0;1;5.0;5.0;5.0;;;;;;;;;79.0;Ich würde sagen, das wir trotz Jahrzehnte lange Forschung bisher nur geschafft haben, das die KI im einen bestimmten Bereich besser ist als wir Menschen. Also das das noch lange dauert, wenn es überhaupt technisch möglich ist, das es eine gibt die alles macht. Damit meine ich, das eine KI- Anwedung nur in einen beliebigen Bereich besser ist und nicht in jeden bereich;;;;;5.0;5.0;5.0;;;;;;;;;[True, True, True, True];[];[False, True, True, False];[False, True, False, True, False, False, True];[True, False, True];[];[];[];[False, True];[True, False];[False, True];[];[];[False, True];[];[];75.0;100.0;;;;;;;;;hZ9Hi9DLZSm5JMbNm
PWuKnsCopAGh2sBNd;42;51.1;1.2166666666666668;62.0;68.0;;49.0;;57.0;;;58.0;17.0;62.0;Künstliche Intelligenz ist ein Programm, welches Aufgaben erfühlt. Bei jeder Aufgabe welche die KI löst sollte sie daraus lernen, sodass die KI die Aufgabe beim nächsten mal schneller und besser lösen kann. Das Ziel der KI ist das sie aus vielen Aufgaben lernt und so weiterkommt.;FALSE;FALSE;1;0;0;4.0;4.0;5.0;KI sind Programme die aus Aufgaben lernen und so klüger werden. Es gibt 2 Arten von KI, die spezifische KI und die allgemeine KI. Die spezifische KI sind KI die nur für eine Aufgabe genutzt werden können. Allgemeine KI sind bis jetzt nur in Science Fiction Filme und nicht in der Realität zu finden, da sie so weit entwickelt sind und mehrere Sachen gleichzeitig machen können.;FALSE;5;0;0;5.0;4.0;4.0;Maschinelles lernen ist wenn ein Algorithmus aus Beispielen lernt und daraus klüger wird.;FALSE;1;0;0;5.0;5.0;5.0;;;;;;;;;33.0;Wenn eine Person Angst hat vor der Zukunft mit KI, weil er dann sein Job verliert dann ist seine Angst verständlich, aber wenn eine Person Angst hat von der Zukunft mit KI, weil die Person Angst hat das die KI die Welt erobert wie in Filmen ist die Angst nicht so ganz berechtigt da so eine KI sehr unwahrscheinlich ist.;;;;;5.0;3.0;3.0;;;;;;;;;[True, True, False, True];[];[True, True, False, False];[True, True, True, False, False, False, True];[True, False, True];[];[];[];[True, False];[True, False];[False, True];[];[];[False, True];[];[];81.0;84.0;Ich fand es besonders gut das die Information nicht nur aus Texten bestehen sondern auch aus Spielen und Videos.;;;;;5.0;5.0;5.0;hZ9Hi9DLZSm5JMbNm
uTPg987piPWyy8CPH;66;29.75;0.45075757575757575;48.0;72.0;72.0;86.0;100.0;80.0;73.0;100.0;100.0;28.0;88.0;Eine KI ist ein Computer der wie ein Mensch Lernen kann;FALSE;FALSE;1;2;0;4.0;4.0;3.0;spezifische KIs können nur einen bestimmten Job machen für den sie programmiert werden.Allgemeine KIs können selber Lernen;FALSE;2;0;0;5.0;4.0;3.0;Maschinen Lernen ob Entscheidungen richtig waren oder ob es Falsch war;FALSE;1;0;0;4.0;4.0;4.0;Maschinen erkennen was sie richtig machen und was Falsch dadurch verbessern sie sich <br>;FALSE;1;0;0;5.0;4.0;3.0;100.0;Die Jobs werden sehr erleichtert und schwierige aufgaben können von KIs übernommen werden;;;;;5.0;4.0;4.0;Die KI würde die Seehunde als hunde Erkennen;;;;;5.0;5.0;5.0;[True, False, True, True];[True, False, True, False];[False, True, True, False];[False, True, False, False, True, False, True];[True, False, True];[True, False, False, True, False, True, False, False, True];[False, True, True];[False, False, True, True];[True, False];[True, False];[False, True];[True, True];[True, False, True];[False, True];[True, False, False, True, False, False, False, True];[True, False, False];100.0;85.0;Es war sehr interessant und ich habe keine weiteren Vorschläge;;;;;5.0;1.0;0.0;NCm8NNbAmNsur5S33
fJbmKwDHZbiXR5xL4;11;1.6;0.14545454545454548;13.0;67.0;;;;77.0;;;;;;edrferw;FALSE;TRUE;0;0;0;1.0;1.0;1.0;wartat  ;TRUE;0;0;0;1.0;1.0;1.0;;;;;;;;;;;;;;;;;;;;;;;;;;;;;;;;;;[False, True, False, False];[];[True, True, True, False];[False, True, False, False, False, False, False];[False, True, False];[];[];[];[];[];[];[];[];[];[];[];;;;;;;;;;;NCm8NNbAmNsur5S33
X3JDYSzxpuDpoRjdJ;66;60.71666666666667;0.919949494949495;1.0;39.0;54.0;33.0;52.0;42.0;46.0;52.0;69.0;41.0;47.0;Es kann vieles Erleichtern aber es kann auch Probleme mitsichbringen die man zuvor nicht hatte;FALSE;FALSE;0;0;1;4.0;3.0;3.0;;;;;;;;;;;;;;;;;;;;;;;;;100.0;;;;;;;;;;;;;;;;;[False, False, False, True];[True, True, True, False];[False, True, True, False];[False, True, True, True, True, False, False];[False, True, True];[True, False, False, False, True, True, False, False, True];[False, True, True];[False, False, True, True];[True, False];[False, True];[False, True];[True, False];[True, True, False];[False, True];[False, False, False, True, False, True, True, False];[True, True, False];81.0;98.0;;;;;;;;;NCm8NNbAmNsur5S33
iFu7aGDqSfNbSFvoL;54;116.91666666666667;2.1651234567901234;20.0;27.0;;74.0;;30.0;;;70.0;33.0;44.0;vielleicht bedeutet Künstliche Intelligenz mit Maschinen zu lernen oder Hilfsmittel bei der Arbeit.<br>;FALSE;FALSE;0;0;1;4.0;4.0;4.0;KI lernt durch Erfahrung und ist inteligenz die der Mensch selbst noch nicht hat.;FALSE;1;1;0;4.0;3.0;4.0;ich weiß noch nichts darüber.;TRUE;0;0;0;2.0;2.0;2.0;;;;;;;;;66.0;Ich denke es gibt auch Nachteile von KI aber es kann auch viele Vorteile mit sich bringen. wie Z.b. im Krankenhaus oder anderen Berufen. Der Nachteil ist vielleicht das durch KI andere Berufe bedroht sind die nicht mit KI arbeiten.;;;;;5.0;4.0;4.0;;;;;;;;;[True, False, False, True];[];[True, True, False, False];[False, True, True, True, False, False, False];[False, True, False];[];[True, True, False];[True, True, False, True];[True, False];[False, True];[True, False];[];[False, True, False];[False, True];[];[];72.0;88.0;nein;;;;;2.0;2.0;2.0;NCm8NNbAmNsur5S33
Mmmee2H4PhbLb9iyn;46;22.85;0.4967391304347826;100.0;100.0;;32.0;;67.0;;;100.0;51.0;67.0;Die Künstliche Inteligenz sind in Spielen Computergegner;FALSE;FALSE;1;0;0;3.0;3.0;3.0;Also künsltiche Inteligenz ist in den elektrischen geräten drinnen die Aufträge für einen Ausführen;FALSE;0;1;0;5.0;3.0;3.0;Ich glaube da bringen einem Maschienen etwas bei;FALSE;0;1;0;2.0;2.0;2.0;;;;;;;;;100.0;KI ist häufig eine unterstützung für Mnschen die irgendwelche behinderungen haben und ohne KI würde auch manche arbeit nicht möglich sein<br>;;;;;3.0;3.0;3.0;;;;;;;;;[False, True, False, False];[];[True, False, True, True];[True, False, True, False, True, True, False];[False, True, True];[];[];[False, True, False, True];[False, True];[True, False];[False, True];[];[];[False, True];[];[];100.0;100.0;Es ist sehr schön zum lernen und macht auch spaß;;;;;5.0;0.0;0.0;NCm8NNbAmNsur5S33
F2BGnvYsGsyzPwBCh;66;25.516666666666666;0.3866161616161616;1.0;15.0;100.0;100.0;100.0;19.0;49.0;100.0;62.0;23.0;37.0;ein Computer der Teilweise selbständig handeln kann;FALSE;FALSE;1;0;0;4.0;3.0;3.0;eine art selbständiges Computersystem;FALSE;1;0;0;4.0;4.0;3.0;ich weis noch nichts;TRUE;0;0;0;3.0;3.0;3.0;das maschienen erkennen was sie richtig und falsch gemacht haben und sich verbessern;FALSE;1;0;0;3.0;3.0;3.0;100.0;Es gibt immer ein risiko das man bedenken muss aber alles in allem ist es eigentlich ganz gut;;;;;3.0;3.0;2.0;es würde vielleicht nichts erkennen;;;;;4.0;3.0;3.0;[False, True, False, False];[True, False, True, False];[True, False, False, False];[False, True, False, True, False, False, False];[True, False, True];[False, False, False, False, False, True, False, False, True];[False, True, False];[True, True, False, True];[True, False];[True, False];[True, False];[True, True];[True, False, True];[False, True];[True, False, True, True, False, True, True, True];[True, True, False];100.0;100.0;ich habe alles sehr gut gefunden;;;;;5.0;0.0;0.0;NCm8NNbAmNsur5S33
eg47Y5Kpse2DetQ2n;66;134.36666666666667;2.035858585858586;15.0;47.0;56.0;36.0;49.0;44.0;48.0;55.0;55.0;45.0;52.0;KI sind Programme die das gleiche (oder mehr) wissen haben wie das Gehirn und dieses nachmachen.;FALSE;FALSE;0;1;0;5.0;5.0;4.0;KI gibt es in fast allen Anwendungen.Es gibt spezifische und allgemeine KI, die spezifische KI ist nur in einem bestimmten Bereich intelligent z. B Gesichsterkennung eben nur in der Gesichtserkennung;FALSE;3;0;1;4.0;4.0;4.0;Ich weiß leider noch nichts über maschinelles Lerne.;TRUE;0;0;0;3.0;3.0;3.0;Ein System, welches durch Erfahrungen selbstständig lernt.;FALSE;2;0;0;3.0;3.0;3.0;75.0;Ich denke, wenn man die KI weiterhin richtig weiterentwickelt, braucht man sich nicht all zu große Sorgen machen. Wenn sie jedoch nicht gut bzw. richtig weiterentwickelt wird, kann ich die Bedenken verstehen.;;;;;5.0;5.0;4.0;Dann würden richtige Hunde nicht mehr als Hunde zugeteilt werden, sondern nur noch die Seehunde ;;;;;4.0;3.0;5.0;[True, True, False, True];[True, True, True, False];[True, True, True, False];[True, False, False, True, False, False, True];[True, False, False];[True, False, True, True, False, True, False, False, True];[False, True, True];[False, True, True, True];[False, True];[True, False];[False, True];[False, True];[False, True, True];[False, True];[True, False, False, True, False, True, True, True];[True, True, False];92.0;100.0;"Die Ladezeit ist manchmal etwas lang und die ""weiter"" Knöpfe sind in meinen Augen etwas unnötig, aber ansonsten war/bin ich sehr zufrieden.<br>";;;;;5.0;2.0;0.0;NCm8NNbAmNsur5S33
x9cvAEjXv473yQT5t;66;34.36666666666667;0.5207070707070707;56.0;58.0;55.0;65.0;60.0;48.0;53.0;58.0;54.0;28.0;60.0;"<span style=""color: rgb(77, 81, 86);"">ist ein Teilgebiet der Informatik, das sich mit der Automatisierung intelligenten Verhaltens und dem maschinellen Lernen befasst</span>";FALSE;TRUE;0;0;0;5.0;4.0;4.0;"<span style=""color: rgb(32, 33, 36);"">Die&nbsp;</span><strong style=""color: rgb(32, 33, 36);"">KI</strong><span style=""color: rgb(32, 33, 36);"">,&nbsp;</span><strong style=""color: rgb(32, 33, 36);"">einfach erklärt</strong><span style=""color: rgb(32, 33, 36);"">, ist der Versuch, menschliches Lernen und Denken auf den Computer zu übertragen und ihm damit Intelligenz zu verleihen. ... Ziel der&nbsp;</span><strong style=""color: rgb(32, 33, 36);"">KI</strong><span style=""color: rgb(32, 33, 36);"">-Forschung ist es seit jeher, die Funktion unseres Gehirns und unseres Geists einerseits zu verstehen und andererseits künstlich nachbauen zu können.</span>";TRUE;0;0;0;5.0;3.0;2.0;"<strong style=""color: rgb(32, 33, 34);"">Maschinelles Lernen</strong><span style=""color: rgb(32, 33, 34);"">&nbsp;ist ein Oberbegriff für die „künstliche“ Generierung von&nbsp;</span><a href=""https://de.wikipedia.org/wiki/Wissen"" rel=""noopener noreferrer"" target=""_blank"" style=""color: rgb(11, 0, 128);"">Wissen</a><span style=""color: rgb(32, 33, 34);"">&nbsp;aus&nbsp;</span><a href=""https://de.wikipedia.org/wiki/Erfahrung"" rel=""noopener noreferrer"" target=""_blank"" style=""color: rgb(11, 0, 128);"">Erfahrung</a><span style=""color: rgb(32, 33, 34);"">: Ein künstliches System lernt aus Beispielen und kann diese nach Beendigung der&nbsp;</span><a href=""https://de.wikipedia.org/wiki/Lernen"" rel=""noopener noreferrer"" target=""_blank"" style=""color: rgb(11, 0, 128);"">Lernphase</a><span style=""color: rgb(32, 33, 34);"">&nbsp;verallgemeinern.&nbsp;</span>";TRUE;0;0;0;1.0;0.0;0.0;Maschinen können erkennen ob es richtig oder falsch läuft und sich so verbessern;FALSE;1;0;0;4.0;3.0;3.0;56.0;ich finde es nicht bedrohend oder schädlich;;;;;3.0;3.0;3.0;Die KI würde sie trotzdem als hunde erkennen;;;;;3.0;3.0;3.0;[True, False, False, True];[True, False, True, False];[True, False, False, True];[False, False, True, False, False, False, True];[True, True, False];[True, False, False, True, False, True, False, False, True];[False, True, False];[False, True, True, False];[True, False];[True, False];[False, True];[True, True];[True, False, False];[False, True];[True, False, True, True, False, True, True, True];[True, False, False];100.0;100.0;Ich fande es eine sehr hilfreiche und interessante art und weise etwas neues zu lernen. fande es Top;;;;;5.0;1.0;0.0;NCm8NNbAmNsur5S33
rdey75egbdBviYKD6;66;100.91666666666667;1.5290404040404042;46.0;29.0;67.0;40.0;46.0;21.0;45.0;59.0;55.0;54.0;63.0;"Ich denke Künstliche Intelligenz sind beispielsweise Roboter, die irgendwelche alltäglichen Dinge für uns Menschen erledigen können. Durch die künstliche Intelligenz kann beispielsweise mithilfe von Informationstechnischen Steuerungen ""modern"" gelernt werden, aber die künstliche Intelligenz kann auch in vielen anderen Bereichen vertretbar sein und angewendet werden.";FALSE;FALSE;0;1;1;5.0;5.0;5.0;KI ist die Künstliche Intelligenz;FALSE;0;0;1;2.0;2.0;2.0;;TRUE;0;0;0;2.0;2.0;2.0;"Beim maschinellen Lernen bauen die Algorithmen mit Hilfe von Trainingstaten Modelle auf, um nach vermehrtem ""lernen"" eine Struktur zu bilden. Irgendwann kann der Algorithmus die Dinge selbst erkennen.";FALSE;3;0;0;5.0;5.0;5.0;60.0;Ich denke die Besorgtheit ist durchaus berechtigt, aber durch eine Sehr lange Entwicklung der unterschiedlichen KIs werden diese vemutlich immer besser. Allerdings ist es auch so, dass bestimmte Dinge einfach nicht durch KI ersetzt werden können. (Pflegeberufe etc);;;;;5.0;5.0;5.0;Ich denke der Algorithmus würde nicht erkennen, dass es Seehunde sind er würde also weiter der Meinung sein, dass es Hunde sind.;;;;;5.0;4.0;3.0;[True, False, True, True];[True, False, True, False];[True, False, True, False];[False, True, False, True, False, False, True];[True, True, False];[True, False, True, True, False, False, True, False, True];[True, True, False];[True, False, True, True];[False, True];[False, True];[False, True];[False, True];[True, False, True];[False, True];[False, False, True, False, False, True, True, True];[True, False, False];59.0;74.0;Ich fand es gut;;;;;3.0;3.0;3.0;NCm8NNbAmNsur5S33
8hxAMt4258GP8RcE8;66;43.3;0.656060606060606;52.0;44.0;58.0;56.0;56.0;53.0;58.0;58.0;51.0;39.0;54.0;roboter<br>;FALSE;FALSE;0;1;0;1.0;1.0;1.0;"<span style=""background-color: rgba(4, 4, 5, 0.07); color: rgb(220, 221, 222);"">ist ein Teilgebiet der Informatik, das sich mit der Automatisierung intelligenten Verhaltens und dem maschinellen Lernen befasst</span>";TRUE;0;0;0;4.0;4.0;4.0;"<span style=""background-color: rgb(54, 57, 63); color: rgb(220, 221, 222);"">Maschinelles Lernen ist ein Oberbegriff für die „künstliche“ Generierung von Wissen aus Erfahrung: Ein künstliches System lernt aus Beispielen und kann diese nach Beendigung der Lernphase verallgemeinern.</span>";TRUE;0;0;0;1.0;0.0;0.0;maschinen kontrollieren und verbessern sich selbst ;FALSE;2;0;0;3.0;3.0;3.0;52.0;Ich finde es nicht bedrohend oder schädlich<br>;;;;;3.0;3.0;3.0;sie würden sie trozdem als hunde erkennen<br>;;;;;3.0;3.0;3.0;[False, False, True, True];[True, False, True, False];[False, True, False, True];[False, False, False, True, False, False, True];[True, True, False];[True, True, False, False, False, True, False, False, True];[True, False, False];[True, False, True, False];[True, False];[True, False];[True, False];[True, True];[True, False, True];[False, True];[True, False, True, True, False, True, True, True];[True, False, False];100.0;100.0;Ich finde es eine sehr hilfreiche und interessante weise zu lernen ;;;;;5.0;0.0;0.0;NCm8NNbAmNsur5S33
HxKGojut2Tgf5rb4c;57;67.18333333333334;1.178654970760234;7.0;64.0;;67.0;;57.0;;;49.0;50.0;26.0;<ul><li>meiner Meinung nach kann man darunter alles verstehen was kunst und intelligenz betrifft</li><li>warscheinlich meint man mit künstlich kreatives</li></ul>;FALSE;FALSE;0;1;0;4.0;4.0;3.0;KI gibt es in vielen Formen der Technologie. Zum Beispiel sorgt die KI dafür das mein Instagram Feed sich neu ladet mit Bildern die mich interessieren und es schlägt mir Dinge vor basierend auf Dingen die ich mag oder gekauft habe.;FALSE;1;0;0;5.0;5.0;5.0;Ich denke Maschinelles lernen bedeutet Maschinen lernen dazu und bilden sich selber fort.;FALSE;0;0;1;2.0;2.0;2.0;;;;;;;;;96.0;Es wird aufjedenfall seine Vorteile mit sich bringen und helfen wird es auch viel. Aber es hat eher mehr Nachteile und wenn sowas in der Zukunft passieren sollte muss man noch besser auf seine persönlichen Daten aufpassen. Und was man preisgibt im Internet.;;;;;5.0;4.0;4.0;;;;;;;;;[True, True, True, True];[];[True, False, False, False];[False, True, False, False, False, False, False];[True, False, False];[];[True, False, True];[False, True, True, False];[True, False];[True, False];[True, False];[];[True, False, True];[False, True];[];[True, True, False];70.0;84.0;Ich fand alles gut und verständlich. Die Texte waren sehr hilfreich.;;;;;4.0;3.0;4.0;NCm8NNbAmNsur5S33
8BxHyj57tDQP6thKX;66;25.766666666666666;0.39040404040404036;37.0;25.0;75.0;1.0;100.0;25.0;100.0;100.0;30.0;8.0;1.0;Eine schlaue Maschiene ;FALSE;FALSE;0;1;0;3.0;3.0;2.0;es ist ein künstliches Gehirn ;FALSE;0;1;0;2.0;2.0;2.0;das weiß ich nicht <br>;TRUE;0;0;0;3.0;3.0;3.0;maschienen erkennen was sie richtig und falsch gemacht haben und sich verbessern ;FALSE;1;0;0;5.0;4.0;3.0;35.0;die jobs werden leichter und die schwierigen arbeiten werden übernommen ;;;;;5.0;4.0;4.0;es würde nichts erkennen;;;;;4.0;3.0;3.0;[False, True, False, False];[True, False, True, False];[True, False, False, False];[False, True, False, True, False, True, False];[True, False, False];[True, False, False, True, False, True, False, False, True];[False, True, False];[False, True, False, True];[True, False];[True, False];[False, True];[True, True];[False, True, False];[False, True];[True, False, True, True, False, True, True, True];[True, True, False];47.0;59.0;war sehr interesant ;;;;;5.0;0.0;0.0;NCm8NNbAmNsur5S33
XjSEcRBzt99CQK253;6;14.6;2.433333333333333;27.0;;;;;;;;;;;Künstliche Intelligenz ist ein Teil der der Informatik/ Elektronik. Diese befasst sich mit dem maschinellen lernen.;FALSE;FALSE;2;0;0;5.0;3.0;3.0;;;;;;;;;;;;;;;;;;;;;;;;;;;;;;;;;;;;;;;;;;[True, False, True, True];[];[];[];[True, False, True];[];[];[];[];[];[];[];[];[];[];[];;;;;;;;;;;NCm8NNbAmNsur5S33
NHPSudYwp9A4DT5t2;43;43.31666666666667;1.0073643410852713;100.0;9.0;;67.0;;7.0;;;65.0;35.0;53.0;Wenn man gut Zeichnen oder malen kann fast schon so gut wie ein Künstler;FALSE;FALSE;0;1;0;2.0;3.0;4.0;<h1>KL. steht für Kapitänleutnant Kazaa lite und das ist ein Programm glaub ich.</h1><br><br>PS: Ich hab gegoogelt weil ich keine Ahnung hatte:);FALSE;0;1;0;3.0;3.0;3.0;;;;;;;;;;;;;;;;;59.0;Ich würde mit der person erstmal darüber sprechen und halt Fragen was für ein beruf Er oder sie hat und der person dannn alles erklären und viellicht auch die Angst nehmen;;;;;5.0;4.0;4.0;;;;;;;;;[True, False, True, False];[];[False, False, True, False];[False, False, False, True, True, False, False];[False, True, False];[];[False, True, True];[];[True, False];[True, False];[False, True];[];[];[False, True];[];[];100.0;88.0;Ich habe alles sehr gut gefunden und habe keine Verbesserungsvorschläge. <br>ich habe auch viel dazugelernt.;;;;;5.0;5.0;5.0;NCm8NNbAmNsur5S33
zBgRiFyXPXhDqsqwb;66;178.48333333333332;2.704292929292929;1.0;52.0;41.0;59.0;39.0;39.0;58.0;44.0;46.0;45.0;56.0;Künstliche Intelligenz könnte sein das man was am PC malen oder sich künstlich machen soll.Und vielleicht Häuser bauen und kaufen ;FALSE;FALSE;0;2;0;3.0;4.0;3.0;Es gibt verschiedene Arten von Kl wie zum beispiel auch in spielen oder Filmen. Es Könnte sein dass das wo wir in den Filmen sehen schon bald in Realität passiert aber die Forscher sind da schon Jahrhunderte dran;FALSE;2;0;1;4.0;4.0;4.0;maschinelles Lernen ist glaub ich lernen mit Geräten die dir helfen etwas zu lernen;FALSE;0;1;0;3.0;2.0;2.0;;;;;;;;;58.0;Ich würde sagen das KI aufjedenfall kommt aber das wir Menschenauch in manchen Sachen auch besser sind und die KI nicht ersetzen kann.;;;;;3.0;3.0;2.0;Ich glaube es würde verwechselt weil sie sich nicht unterscheiden;;;;;3.0;3.0;3.0;[True, False, False, True];[True, True, False, False];[True, False, True, True];[True, True, True, False, False, True, True];[True, True, False];[False, True, False, True, True, True, False, False, True];[True, True, False];[True, True, False, True];[True, False];[True, False];[False, True];[False, True];[False, True, False];[False, True];[True, True, False, False, False, True, False, True];[True, True, False];92.0;100.0;Ich fande es war sehr gut man hat viel gelernt es war einfach und verständlich und abwechslungsreich perfekt ich habe nichts zu verbessern;;;;;5.0;5.0;5.0;NCm8NNbAmNsur5S33
rZonxXtMrqpQXsBqY;19;15.166666666666666;0.7982456140350876;42.0;67.0;;;;38.0;;;;;;Wenn glaub jemand was sehr gut weiß;FALSE;FALSE;0;1;0;2.0;2.0;2.0;;;;;;;;;;;;;;;;;;;;;;;;;;;;;;;;;;;;;;;;;;[False, True, True, False];[];[True, True, True, False];[False, True, True, True, False, True, False];[False, True, True];[];[];[];[];[];[];[];[];[False, True];[];[];;;;;;;;;;;NCm8NNbAmNsur5S33
tpz88kuoMHS8jFg6o;31;39.46666666666667;1.2731182795698925;100.0;100.0;;;;14.0;;;87.0;68.0;100.0;;TRUE;;;;;;;;;;;;;;;;;;;;;;;;;;;;;;;;80.0;;;;;;;;;;;;;;;;;[True, False, False, True];[];[False, True, True, False];[False, True, False, False, True, True, True];[True, True, False];[];[];[];[];[];[];[];[];[False, True];[];[];100.0;82.0;;;;;;;;;hZ9Hi9DLZSm5JMbNm
BvGkjti4sPdAMYcit;42;18.133333333333333;0.4317460317460317;29.0;55.0;;56.0;;37.0;;;75.0;100.0;29.0;Künstliche Inteligenz ist ein Programm welches mit Hilfe von Berechnngen versucht eine Inteligenz zu erschaffen welche der des Menschen ähnelt.;FALSE;FALSE;1;1;0;4.0;4.0;5.0;Eine KI ist eine Künstliche Inteligenz welche dazu in der Lage ist eigenständig entscheidungen zu treffen.;FALSE;1;0;0;3.0;4.0;2.0;Maschinen lernen durch ihre Fehler;FALSE;0;0;1;4.0;4.0;4.0;;;;;;;;;100.0;;;;;;;;;;;;;;;;;[True, True, False, True];[];[True, True, False, False];[True, True, False, False, False, True, True];[True, True, False];[];[];[];[True, False];[True, False];[False, True];[];[];[False, True];[];[];92.0;97.0;;;;;;;;;hZ9Hi9DLZSm5JMbNm
