p6rqDWboxMdrMYYhm;66;23.35;0.3537878787878788;100.0;68.0;46.0;68.0;34.0;100.0;64.0;70.0;36.0;67.0;77.0;Künstliche Inteligenz sind Roboter mit Gehirnen aus Technick.;FALSE;FALSE;0;1;0;5.0;5.0;5.0;ki ist künstliche intelligenz und kann viele sachen die der Mensch auch Kann und Kann dadurch den Menschen etwas erleichtern;FALSE;1;0;0;3.0;3.0;3.0;Ich weis noch nicht so viel.;TRUE;0;0;0;3.0;3.0;3.0;???;TRUE;0;0;0;0.0;0.0;0.0;100.0;solange wir nicht zu viel durch ki ersetzt werden besteht noch keine gefahr aber es entsteht immer mehr davon. ;;;;;1.0;1.0;1.0;es würden viele beschwerden kommen weil sie Hunde und Keine Seehunde sehen wollen.;;;;;3.0;3.0;3.0;[True, True, True, True];[True, True, True, False];[True, True, False, False];[True, False, True, True, False, True, False];[False, True, True];[True, False, True, True, True, True, True, True, True];[True, True, False];[False, False, True, True];[True, False];[False, True];[True, False];[True, True];[False, True, True];[False, True];[True, False, True, False, True, False, False, True];[True, True, True];100.0;100.0;ich fand es sehr lustig;;;;;4.0;4.0;4.0;SwfuMxSGoy4aKziD8
iw9PMBZxHo8Jjyhw5;66;58.483333333333334;0.8861111111111111;84.0;75.0;65.0;76.0;64.0;1.0;52.0;66.0;64.0;65.0;55.0;eine Künstliche Intelligenz ist z.B. Alexa oder Siri sie haben ein zugriff auf das Internet und können fast alle fragen beantworten.;FALSE;FALSE;1;1;0;4.0;4.0;4.0;KI bedeutet Künstliche Intiligenz;FALSE;0;0;1;3.0;3.0;3.0;Ich weißt noch nichts.;TRUE;0;0;0;3.0;3.0;3.0;;;;;;;;;78.0;Das eine KI nicht einfach so besser als der Mensch werden kann da der Mensch sie programmiert.;;;;;3.0;3.0;3.0;;;;;;;;;[True, True, True, True];[True, False, True, False];[False, False, True, True];[False, False, False, True, True, False, True];[True, True, False];[True, False, False, True, False, True, False, False, True];[True, False, True];[False, True, True, False];[False, True];[True, False];[False, True];[True, True];[True, False, False];[False, True];[True, False, True, True, False, True, True, True];[True, True, False];87.0;100.0;Alles war eigentlich relativ gut, aber manchmal was es sehr sehr kiffilig;;;;;4.0;4.0;4.0;SwfuMxSGoy4aKziD8
hpxopbQMRwF8CsW3i;66;45.016666666666666;0.682070707070707;74.0;51.0;54.0;23.0;68.0;58.0;58.0;81.0;58.0;71.0;100.0;eine KI ist z.B Google Assistant oder Siri;FALSE;FALSE;1;0;0;5.0;5.0;5.0;eine KI ist eine Künstliche Intilligens wie z.B Siri.es gibt verschiedene arten von KI z.B spezifische KI und allgemeine KI<br>;FALSE;2;0;0;4.0;3.0;3.0;Ich weiß es nicht;TRUE;0;0;0;3.0;3.0;3.0;;;;;;;;;100.0;er sollte der KI eine chance geben da KIs oft sehr nützlich sind;;;;;3.0;3.0;3.0;;;;;;;;;[True, True, False, True];[True, False, True, False];[True, False, True, False];[True, False, True, False, False, True, True];[True, False, False];[False, True, True, True, False, True, True, False, True];[False, True, False];[False, False, True, True];[True, False];[True, False];[False, True];[True, False];[True, True, False];[False, True];[True, False, True, False, True, True, False, True];[True, False, True];100.0;100.0;Alles fande ich so gut;;;;;4.0;4.0;4.0;SwfuMxSGoy4aKziD8
aMC2BqF5wkkuAJnFT;66;55.083333333333336;0.8345959595959597;97.0;92.0;67.0;78.0;59.0;87.0;100.0;1.0;76.0;22.0;52.0;"KI ist ein ""Programm"" was z.B. einem Roboter Grundwissen aneignet, welches er dann durch üben und trainieren verbessern kann, er lernt also. Mit einem KI Roboter werden z.B. Pakete verpackt und der Roboter lernt, besser zu sein.";FALSE;FALSE;1;0;0;5.0;5.0;5.0;KI ist ein Programm, das unterschiedliche Sachen ausführt. Sie lernt dazu, indem sie arbeitet. Es gibt allgemeine KI, welche viele Sachen kann und spezifische KI, die sich auf was spezialisiert.;FALSE;4;0;0;4.0;4.0;4.0;Hab falsch abgestimmt, bin mir nicht sicher.;TRUE;0;0;0;3.0;3.0;3.0;Maschinelles lernen ist, wenn Maschinen mit KI durch ausführen ihrer Aufgabe lernen.;FALSE;1;0;0;3.0;3.0;3.0;100.0;KI kann gut sein, da sie viele Sachen für uns übernehmen kann, allerdings birgt sie auch Risiken, da sie vielleicht falsch arbeitet oder zu schlau wird.;;;;;3.0;3.0;3.0;;;;;;;;;[False, True, False, True];[True, True, True, False];[False, True, True, True];[True, True, True, False, True, True, False];[False, True, True];[True, False, False, True, False, True, True, True, True];[False, True, True];[True, False, False, False];[True, False];[False, True];[True, False];[True, True];[True, False, True];[False, True];[True, True, False, True, False, True, False, True];[True, True, False];34.0;45.0;Man könnte evtl. den Fehler beheben, dass manchmal die Grafiken nicht angezeigt werden.;;;;;3.0;3.0;3.0;SwfuMxSGoy4aKziD8
vWpXDC4vwRfTmxuAe;54;58.083333333333336;1.0756172839506173;33.0;53.0;57.0;64.0;53.0;49.0;47.0;53.0;;;;Ich denke Künstliche Intelligenz ist sowas ähnliches wie ein Programm.;FALSE;FALSE;0;0;1;3.0;3.0;3.0;gesichts erkennung ist KI;FALSE;1;0;0;2.0;2.0;2.0;wir wissen noch nicht wirklich etwas darüber;TRUE;0;0;0;3.0;3.0;3.0;;;;;;;;;;;;;;;;;;;;;;;;;;[True, False, True, True];[True, False, True, False];[True, False, True, False];[False, True, False, False, True, False, False];[True, True, False];[True, True, False, True, False, True, False, True, True];[False, True, True];[False, True, True, False];[False, True];[True, False];[False, True];[True, True];[True, False, True];[False, True];[True, False, True, True, False, False, False, False];[True, True, False];;;;;;;;;;;SwfuMxSGoy4aKziD8
8GjW6ruj9g24s5PpB;66;39.25;0.5946969696969697;100.0;100.0;100.0;100.0;100.0;100.0;100.0;100.0;100.0;1.0;49.0;k.i steht für künstlich intiigens selbstlernendes intiligentez computersystem eine ki kann einfache aufgaben übernehmen;FALSE;FALSE;1;0;1;3.0;3.0;3.0;ein intiligenter computer;FALSE;0;0;1;2.0;2.0;2.0;Keine Ahnung;TRUE;0;0;0;3.0;3.0;3.0;;;;;;;;;100.0;;;;;;;;;;;;;;;;;[True, True, False, True];[True, False, True, False];[True, True, True, False];[True, True, False, True, True, True, True];[True, False, True];[False, False, True, True, False, True, True, False, True];[False, True, True];[True, False, False, True];[True, False];[True, False];[True, False];[True, True];[True, True, False];[False, True];[False, True, True, True, False, True, False, True];[True, False, False];72.0;74.0;NOP;;;;;0.0;0.0;0.0;SwfuMxSGoy4aKziD8
hxfGmAM3fiXFmT2ju;50;39.38333333333333;0.7876666666666666;1.0;1.0;31.0;1.0;18.0;1.0;29.0;41.0;;;;ich finde ki gut weil man nicht viel machen muss;FALSE;FALSE;0;0;1;3.0;3.0;3.0;KI kann was lernen und wird mit der Zeit immer schlauer.;FALSE;1;0;0;3.0;3.0;2.0;Wir wissen leider nichts.;TRUE;0;0;0;3.0;3.0;3.0;;;;;;;;;;;;;;;;;;Der Algorithmus würde denken es wäre ein Hund.;;;;;3.0;3.0;3.0;[True, False, True, True];[True, False, True, True];[True, True, False, False];[False, True, True, False, True, True, False];[True, True, False];[True, True, False, True, True, False, True, True, False];[False, True, True];[True, False, False, True];[True, False];[False, True];[False, True];[True, True];[False, True, True];[False, True];[True, False, False, True, False, True, False, True];[True, False, True];;;;;;;;;;;SwfuMxSGoy4aKziD8
XoYRuCvE5Wu3GhfiN;66;22.7;0.34393939393939393;100.0;59.0;62.0;59.0;100.0;74.0;56.0;100.0;57.0;65.0;58.0;KI ist ein Computer, der selbstständig denken kann und handeln kann.;FALSE;FALSE;1;0;0;1.0;1.0;1.0;KI Anwendung ist allgemein gut, obwohl sie nicht mit eine KI im Verhältnis steht.;FALSE;0;0;1;1.0;1.0;1.0;Maschinelles lernen ist, wenn mnan wissen von einer Maschine direkt ins Gehirn übermittelt bekommt.;FALSE;0;1;0;0.0;0.0;0.0;;;;;;;;;53.0;Das er zu viekle Filme geguckt hat, da KIs oft als Menschenhasser dargestellt werden.;;;;;1.0;1.0;1.0;Alle Leute würden mehr Seehunde lieben, weil man sie mehr zu Gesicht bekommt.;;;;;2.0;2.0;2.0;[True, True, True, True];[True, True, True, False];[True, True, False, True];[True, True, False, True, True, False, True];[True, False, True];[True, False, False, True, True, True, True, True, True];[False, True, False];[True, False, True, True];[False, True];[False, True];[True, False];[True, True];[False, True, False];[False, True];[True, True, False, True, False, True, True, False];[False, True, False];80.0;56.0;Es sollten mehr Gebäude und mehr Investitionen zur Verfügung stehen.;;;;;3.0;3.0;3.0;SwfuMxSGoy4aKziD8
sh2FJtxjHzAbFn9pb;66;64.16666666666667;0.9722222222222223;30.0;35.0;77.0;1.0;46.0;100.0;100.0;47.0;51.0;55.0;49.0;Eine künstliche Intelligenz berechnet Handlungen.Was wäre am Schlausten.Handelt selbst, aber mit Regeln.;FALSE;FALSE;1;1;0;3.0;3.0;3.0;Eine KI ist ein Programm welches lernt und probiert Intelligente Entscheidungen zu treffen.Dabei kriegt er keine Hilfe vom Menschen.Es gibt allgemeine und Spezifische KIs.;FALSE;4;0;0;5.0;5.0;5.0;Weiß nichts über maschinelles Lernen.;TRUE;0;0;0;3.0;3.0;3.0;;;;;;;;;67.0;;;;;;;;;Ein normalen Hund kann der Computer nicht erkennen.Aber er kann Seehunde erkennen, nennt diese aber Hund.;;;;;4.0;4.0;4.0;[False, True, False, True];[True, True, True, False];[True, False, True, False];[True, True, False, False, False, True, True];[True, False, True];[True, True, False, True, False, True, False, False, True];[False, True, False];[False, False, True, True];[False, True];[False, True];[False, True];[False, True];[True, False, True];[False, True];[True, False, True, True, False, True, True, True];[True, True, False];68.0;68.0;;;;;;;;;SwfuMxSGoy4aKziD8
kzJwDntqsEk32r3G9;11;9.15;0.8318181818181819;100.0;97.0;;;;37.0;;;;;;;TRUE;;;;;;;;;;;;;;;;;;;;;;;;;;;;;;;;;;;;;;;;;;;;;;;;;[False, True, True, True];[];[True, False, False, False];[True, False, True, False, False, False, True];[False, True, False];[];[];[];[];[];[];[];[];[];[];[];;;;;;;;;;;93uw8K4BBFGYSbYRK
Nte7oiWpFy9tcr9x6;11;4.1;0.3727272727272727;80.0;65.0;;;;63.0;;;;;;;TRUE;;;;;;;;;;;;;;;;;;;;;;;;;;;;;;;;;;;;;;;;;;;;;;;;;[True, False, False, False];[];[True, False, False, False];[False, False, False, True, False, False, True];[True, True, False];[];[];[];[];[];[];[];[];[];[];[];;;;;;;;;;;93uw8K4BBFGYSbYRK
QEneocCbbPtgSnGrn;4;4.4;1.1;55.0;;;;;;;;;;;;;;;;;;;;;;;;;;;;;;;;;;;;;;;;;;;;;;;;;;;;;;;;;;;;;[False, True, False, True];[];[];[];[];[];[];[];[];[];[];[];[];[];[];[];;;;;;;;;;;93uw8K4BBFGYSbYRK
x5g9fZzgcG4Dd6ern;11;7.833333333333333;0.712121212121212;100.0;100.0;;;;49.0;;;;;;;TRUE;;;;;;;;;;;;;;;;;;;;;;;;;;;;;;;;;;;;;;;;;;;;;;;;;[True, False, True, True];[];[False, True, True, False];[False, True, False, True, True, False, False];[True, True, False];[];[];[];[];[];[];[];[];[];[];[];;;;;;;;;;;93uw8K4BBFGYSbYRK
hWijdr2aymkiWpz5M;4;8.316666666666666;2.0791666666666666;69.0;;;;;;;;;;;;;;;;;;;;;;;;;;;;;;;;;;;;;;;;;;;;;;;;;;;;;;;;;;;;;[False, False, True, False];[];[];[];[];[];[];[];[];[];[];[];[];[];[];[];;;;;;;;;;;93uw8K4BBFGYSbYRK
hEF9vhMqCHQEL3gu9;11;8.8;0.8;50.0;53.0;;;;1.0;;;;;;;TRUE;;;;;;;;;;;;;;;;;;;;;;;;;;;;;;;;;;;;;;;;;;;;;;;;;[True, False, True, True];[];[False, True, False, True];[False, True, False, False, False, False, True];[True, False, False];[];[];[];[];[];[];[];[];[];[];[];;;;;;;;;;;93uw8K4BBFGYSbYRK
XgK8zdHFhbKfwLoQ8;11;6.016666666666667;0.546969696969697;45.0;45.0;;;;46.0;;;;;;;TRUE;;;;;;;;;;;;;;;;;;;;;;;;;;;;;;;;;;;;;;;;;;;;;;;;;[True, True, False, False];[];[False, True, False, False];[False, True, True, False, False, False, False];[True, True, False];[];[];[];[];[];[];[];[];[];[];[];;;;;;;;;;;93uw8K4BBFGYSbYRK
xAHwrsFgdd362EjiG;11;5.9;0.5363636363636364;76.0;99.0;;;;97.0;;;;;;;TRUE;;;;;;;;;;;;;;;;;;;;;;;;;;;;;;;;;;;;;;;;;;;;;;;;;[True, True, True, False];[];[False, True, True, False];[True, True, False, True, True, False, False];[True, False, True];[];[];[];[];[];[];[];[];[];[];[];;;;;;;;;;;93uw8K4BBFGYSbYRK
HWQ4wxcgfYpZGNH4D;11;8.316666666666666;0.756060606060606;89.0;91.0;;;;68.0;;;;;;;TRUE;;;;;;;;;;;;;;;;;;;;;;;;;;;;;;;;;;;;;;;;;;;;;;;;;[True, False, False, False];[];[False, False, True, False];[True, False, True, True, True, False, True];[False, True, True];[];[];[];[];[];[];[];[];[];[];[];;;;;;;;;;;93uw8K4BBFGYSbYRK
oCk6ix5zHZzXNNcSs;6;5.016666666666667;0.8361111111111111;47.0;;;;;;;;;;;;;;;;;;;;;;;;;;;;;;;;;;;;;;;;;;;;;;;;;;;;;;;;;;;;;[False, True, False, True];[];[];[];[False, True, True];[];[];[];[];[];[];[];[];[];[];[];;;;;;;;;;;93uw8K4BBFGYSbYRK
pqEYjt5Ss398KbaQ2;11;6.65;0.6045454545454546;73.0;54.0;;;;54.0;;;;;;;TRUE;;;;;;;;;;;;;;;;;;;;;;;;;;;;;;;;;;;;;;;;;;;;;;;;;[False, True, True, False];[];[False, False, False, False];[True, False, True, False, True, False, True];[False, True, False];[];[];[];[];[];[];[];[];[];[];[];;;;;;;;;;;93uw8K4BBFGYSbYRK
b7ygy5FRpMECBxqNf;3;1.55;0.5166666666666667;75.0;;;;;;;;;;;;;;;;;;;;;;;;;;;;;;;;;;;;;;;;;;;;;;;;;;;;;;;;;;;;;[];[];[];[];[];[];[];[];[];[];[];[];[];[];[];[];;;;;;;;;;;93uw8K4BBFGYSbYRK
n87r23bmKPaxBgKai;6;5.25;875;66.0;;;;;;;;;;;;;;;;;;;;;;;;;;;;;;;;;;;;;;;;;;;;;;;;;;;;;;;;;;;;;[True, True, False, True];[];[];[];[True, False, True];[];[];[];[];[];[];[];[];[];[];[];;;;;;;;;;;93uw8K4BBFGYSbYRK
nXXcSDpSQmKg2aQep;6;6.416666666666667;1.0694444444444444;66.0;;;;;;;;;;;;;;;;;;;;;;;;;;;;;;;;;;;;;;;;;;;;;;;;;;;;;;;;;;;;;[False, True, True, False];[];[];[];[False, False, True];[];[];[];[];[];[];[];[];[];[];[];;;;;;;;;;;93uw8K4BBFGYSbYRK
d6YQguzGvYMH6HKh9;6;5.033333333333333;0.8388888888888889;59.0;;;;;;;;;;;;;;;;;;;;;;;;;;;;;;;;;;;;;;;;;;;;;;;;;;;;;;;;;;;;;[True, True, True, True];[];[];[];[False, False, True];[];[];[];[];[];[];[];[];[];[];[];;;;;;;;;;;93uw8K4BBFGYSbYRK
kmYxTZpWq5FCHZWm2;11;6.433333333333334;0.5848484848484848;48.0;43.0;;;;56.0;;;;;;;TRUE;;;;;;;;;;;;;;;;;;;;;;;;;;;;;;;;;;;;;;;;;;;;;;;;;[True, True, False, True];[];[True, True, False, False];[False, True, False, True, True, False, False];[True, True, False];[];[];[];[];[];[];[];[];[];[];[];;;;;;;;;;;93uw8K4BBFGYSbYRK
usSryE2aLkcATmrYp;6;3.1166666666666667;0.5194444444444445;68.0;;;;;;;;;;;;;;;;;;;;;;;;;;;;;;;;;;;;;;;;;;;;;;;;;;;;;;;;;;;;;[False, True, False, False];[];[];[];[False, True, False];[];[];[];[];[];[];[];[];[];[];[];;;;;;;;;;;93uw8K4BBFGYSbYRK
iQFNkLSHbaSq53ocM;66;29.35;0.4446969696969697;39.0;47.0;45.0;69.0;44.0;49.0;57.0;52.0;66.0;28.0;45.0;;TRUE;;;;;;;;;;;;;;;;;;;;;;;;;;;;;;;;64.0;;;;;;;;;;;;;;;;;[True, True, True, True];[True, False, False, False];[True, True, True, False];[True, True, False, True, True, False, True];[False, True, False];[True, True, False, True, True, False, True, False, True];[True, True, False];[True, False, False, False];[False, True];[True, False];[True, False];[True, False];[False, True, False];[False, True];[True, False, True, False, True, False, True, False];[True, False, True];60.0;69.0;;;;;;;;;Fj6vLBZ78KswTxcPt
AAgNAMNQscqEwnnQp;48;23.25;0.484375;51.0;;61.0;;59.0;;24.0;51.0;57.0;1.0;50.0;Die ki versucht menschliches wissen auf computer zu übertragen;FALSE;FALSE;0;1;0;5.0;5.0;5.0;;;;;;;;;;;;;;;;;Es erkennt Muster von gesammelten daten und verarbeitet diese.;FALSE;2;0;0;5.0;5.0;5.0;79.0;Die KI ist nicht für schlimme sachen da sondern um den alltag zu erleichtern;;;;;5.0;5.0;5.0;Es würde denke ich alles durcheinander kommen;;;;;5.0;5.0;5.0;[False, False, True, True];[True, False, True, False];[];[];[];[False, False, True, True, False, True, False, False, False];[False, True, False];[False, False, True, False];[];[];[];[True, True];[False, True, False];[False, True];[True, False, True, True, False, True, True, True];[True, True, False];49.0;100.0;Ich fand die Aufgabe gut man muss nichts ändern;;;;;5.0;5.0;5.0;3dLAJPXXug3EMqbc5
7vnPeJDmhkYE9zdrM;66;23.233333333333334;0.352020202020202;100.0;98.0;47.0;100.0;53.0;100.0;53.0;49.0;47.0;45.0;54.0;künstlcihe intiiligenz ist habe keine ahnung;FALSE;TRUE;0;0;0;5.0;5.0;5.0;ki ist künstliche intiligenz die deine interessen nach verfolgen kann und gesichtserkennung und sprackerkennung können;FALSE;1;0;0;5.0;5.0;5.0;;;;;;;;;machineles lernen ist wenn die deine interessen verfolgen und dir deine persöhnlichen interessen vorschlagen;FALSE;0;1;0;5.0;5.0;5.0;56.0;es wird nicht so schlimm wie du denkst;;;;;5.0;5.0;5.0;Man kann es nicht mit hunden vergleichen weil sie ganz anders aussehen;;;;;4.0;3.0;4.0;[False, True, True, False];[False, False, True, True];[True, False, True, True];[False, True, True, False, True, False, False];[True, True, False];[False, False, False, False, False, False, False, False, False];[False, False, False];[True, False, True, False];[False, True];[False, True];[False, True];[True, False];[False, True, False];[True, False];[True, False, False, True, False, True, False, False];[True, False, False];53.0;100.0;War vernünftig;;;;;2.0;1.0;1.0;3dLAJPXXug3EMqbc5
RCvrnYZq9Q262BPgi;66;29.65;0.4492424242424242;68.0;83.0;82.0;62.0;67.0;63.0;78.0;62.0;34.0;74.0;58.0;e;TRUE;;;;;5.0;5.0;5.0;KI ist einen art system das genau erkennt nach was du suchst oder likest und gibt die so genau sowas oder ähnliches als werbung oder bei zb insta als empfehlung.zudem ist das system mit allen sozialen netzwerken verbunden so dasd es immer genaue angaben machen kann;FALSE;1;0;0;5.0;5.0;5.0;Weiß nicht;TRUE;0;0;0;5.0;5.0;5.0;;TRUE;0;0;0;5.0;5.0;5.0;100.0;er/sie/es würde sagen das es uns schadet und immer mehr leute so ihre arbeit verlieren;;;;;5.0;5.0;5.0;e;;;;;5.0;5.0;5.0;[True, False, True, False];[True, True, True, True];[True, False, False, True];[True, True, True, True, True, False, True];[True, True, False];[True, False, True, False, True, False, False, True, True];[False, False, True];[False, False, True, True];[True, False];[True, False];[False, True];[False, True];[True, True, False];[False, True];[False, False, False, False, False, False, False, False];[True, True, False];63.0;71.0;e;;;;;5.0;5.0;5.0;3dLAJPXXug3EMqbc5
tsvaTSDWpPbLTpvex;66;15.283333333333333;0.23156565656565656;61.0;77.0;16.0;68.0;38.0;32.0;80.0;52.0;92.0;88.0;29.0;es ist wenn eine Maschine frei denken kann;FALSE;FALSE;0;1;0;5.0;5.0;5.0;ki kann sehr viele all tagst sachen erkennen und verstehen;FALSE;1;0;0;5.0;5.0;5.0;das ist wenn ma zb etwas beim lernen im internet sucht;FALSE;0;1;0;5.0;5.0;5.0;das ist wenn ein zum beispie ein roboter beim lernen hilf oder man etwas im internet sucht;FALSE;0;1;0;5.0;5.0;5.0;19.0;das die zukufst sichereer ist als heute;;;;;5.0;5.0;5.0;ich glaube alle menschen werden verwirt sein;;;;;5.0;5.0;5.0;[False, True, False, False];[True, True, True, False];[False, True, False, True];[False, True, True, False, True, False, True];[False, False, True];[False, True, False, False, False, False, False, False, False];[True, False, True];[True, False, False, False];[True, False];[False, True];[False, True];[False, False];[False, True, False];[True, False];[False, True, True, False, True, False, False, False];[False, True, False];72.0;100.0;man könnte da so machen das es weniger texte in den aufgaben Stellungen sind weil das mach mal echt schwer ist das zu lesen;;;;;5.0;5.0;5.0;3dLAJPXXug3EMqbc5
oX6Z8YXDvABBdmAfm;35;38.1;1.0885714285714285;;;;;;;;;69.0;31.0;65.0;;TRUE;;;;;;;;;;;;;;;;;;;;;;;;;;;;;;;;47.0;Das man sich keine sorgen darüber machen muss da es jetzt auch viele Kl gibt und es bisher keine so schlimme fälle waren (b.z.w wenige) aber man sollte sich keine sorgen machen soll.;;;;;5.0;5.0;5.0;Seehunde und Hunde sind nicht dieselben Tiere und Seehunde können nicht laufen.;;;;;5.0;5.0;5.0;[];[];[];[];[];[];[False, True, True];[True, False, True, False];[];[];[];[];[True, False, True];[False, True];[];[True, False, True];100.0;82.0;Alles war in Ordnung und es hat spaß gemacht die antworten zu beantworten.;;;;;5.0;5.0;5.0;3dLAJPXXug3EMqbc5
JqPnAtx5bCoXz9fZE;66;20.8;0.3151515151515152;69.0;68.0;40.0;67.0;46.0;62.0;48.0;35.0;52.0;44.0;43.0;ich habe keine ahnung was Künstliche intilignz ist ;FALSE;TRUE;0;0;0;5.0;5.0;5.0;KI ist Künstliche Intiligenz die deine interessen weiß und deine gesichtserkennung und spracherkennung spezifische und allgemeine;FALSE;2;0;0;5.0;5.0;5.0;weiß ich noch nichts ;TRUE;0;0;0;5.0;5.0;5.0;Maschinelles lernen ist wenn man etwas liket und dann wird eiem so was ähnliches wieder gezeigt  ;FALSE;1;0;0;5.0;5.0;5.0;49.0;;;;;;;;;Man kann es nicht mit richtigen hunden vergleichen weil sie ander aussehen<br>;;;;;5.0;5.0;5.0;[True, False, False, True];[True, False, True, False];[False, True, True, False];[True, True, False, True, True, False, True];[True, False, True];[False, False, False, True, False, False, False, True, False];[False, False, False];[False, False, True, True];[True, False];[False, True];[True, False];[True, True];[True, False, True];[False, True];[True, False, True, True, False, True, True, True];[True, True, False];45.0;60.0;Es war vernünftig und ich habe es verstanden;;;;;5.0;5.0;5.0;3dLAJPXXug3EMqbc5
cpkJS3soboSzFuTkk;44;47.36666666666667;1.0765151515151514;;;69.0;;64.0;;41.0;42.0;56.0;67.0;56.0;;TRUE;;;;;;;;;;;;;;;;;;;;;;;;Maschinisches lernen ist wenn die Maschinen von alleine nach und nach alles sich selber beibringen und lernen.;FALSE;2;0;0;5.0;5.0;5.0;70.0;Die KI ist eigendlich ganz hilfreich da sie uns in der zukunft ein großteil der arbeit abnehmen kann.;;;;;5.0;5.0;5.0;Es würde sich dann jeder fragen, Warum? Warum maccht man dass?;;;;;5.0;5.0;5.0;[];[False, True, True, False];[];[];[];[False, True, False, True, False, False, False, False, True];[False, True, False];[False, False, True, True];[];[];[];[False, False];[True, False, False];[False, True];[False, True, False, False, False, False, True, False];[False, True, False];98.0;80.0;Die gesamten Aufgaben sind gut gestaltet. Es ist sehr leicht hier etwas zu lernen.;;;;;5.0;5.0;5.0;3dLAJPXXug3EMqbc5
aBaFCcv3MCxmXfCRg;44;34.06666666666667;0.7742424242424243;;;47.0;;72.0;;82.0;56.0;46.0;57.0;38.0;;TRUE;;;;;;;;;;;;;;;;;;;;;;;;Es bedeutet das maschinen mit uns lernen sie werden dabei auch immer inteligen ter .;FALSE;1;0;0;5.0;5.0;5.0;100.0;Daich KI auch nichtso guf findewürdeich dieser person versuchen von den vorteilen zu erzählen allerdings auch von den nachteilen damit ersich seine meinung noch nmal überlegen könnte .<br>;;;;;5.0;5.0;5.0;es wirde falsche vorstellung leiten.;;;;;5.0;5.0;5.0;[];[True, True, True, False];[];[];[];[False, False, False, True, False, True, False, False, False];[True, False, False];[False, True, False, True];[];[];[];[True, True];[True, False, True];[False, True];[False, False, True, False, True, False, False, False];[True, True, False];77.0;83.0;ich findedas dieser test so gut ist. ich finde mann sollte nichts verbessern;;;;;5.0;5.0;5.0;3dLAJPXXug3EMqbc5
T2z2HC9FNA4MgJJjw;66;32.31666666666667;0.4896464646464647;75.0;40.0;69.0;100.0;39.0;91.0;68.0;25.0;14.0;100.0;93.0;Ein KI kann z.b ein Roboter sein oder ein Computer. Der warscheinlich mehr weiß als ein Mensch.;FALSE;FALSE;0;1;0;5.0;5.0;5.0;"KI'S sind intiligente ""Roboter"" die mehr wissen als Menschen haben. ";FALSE;0;1;0;5.0;5.0;5.0;maschinelles lernen ist wenn man sachen googelt speichert unser kopf das Automatisch und dann haben wir es gelernt.;FALSE;0;1;0;5.0;5.0;5.0;Wenn du eine Aufgabe von der Schule machst und sie nicht verstehst googelt es man und man lernt es dann.;FALSE;0;1;0;5.0;5.0;5.0;100.0;Ich wäre auch besorgt wer weiß ob die KI'S sich selber  kontrollieren können und die Menschheit auslöscht;;;;;5.0;5.0;5.0;;;;;;;;;[True, True, True, False];[False, False, False, True];[True, False, True, False];[False, False, True, True, False, False, False];[False, False, True];[True, True, False, True, False, True, False, False, False];[True, False, False];[False, False, True, False];[True, False];[True, False];[False, True];[True, False];[True, False, False];[False, False];[False, True, False, True, False, True, False, False];[True, False, True];85.0;54.0;Ich fand keine frage doof alle waren leicht zu beantworten und es war unkompliziert.;;;;;5.0;5.0;5.0;3dLAJPXXug3EMqbc5
bgY9RjNiipZKeCCaA;44;13.266666666666667;0.3015151515151515;;;49.0;;47.0;;47.0;52.0;48.0;54.0;43.0;;TRUE;;;;;;;;;;;;;;;;;;;;;;;;wenn du was likes dann wird sowas ähnliches wieder angezeigt wird;FALSE;1;0;0;5.0;5.0;5.0;46.0;die ki ist nicht da um schlimme dinge zu machen sondern den alltag zu erleichtern<br>;;;;;5.0;5.0;5.0;duie kann man nicht vergleichen da sie keine hunde sind<br>;;;;;5.0;5.0;5.0;[];[False, False, True, False];[];[];[];[True, False, True, True, False, True, True, True, True];[False, True, False];[False, False, True, True];[];[];[];[False, True];[True, False, True];[False, True];[True, False, True, True, False, True, True, True];[False, True, False];54.0;62.0;;;;;;;;;3dLAJPXXug3EMqbc5
sY9P5NmaCzedBXRtT;66;40.766666666666666;0.6176767676767677;58.0;60.0;65.0;31.0;57.0;58.0;49.0;52.0;56.0;42.0;55.0;meine meinung nach ist das gut;FALSE;FALSE;0;0;1;5.0;5.0;5.0;<em>künstliche Intelligenz</em>;TRUE;0;0;0;5.0;5.0;5.0;nein;TRUE;0;0;0;5.0;5.0;5.0;Maschinelles Lernen ist die Generierung von Wissen aus Erfahrung;FALSE;1;0;0;5.0;5.0;5.0;65.0;KI können gefahren erkennen;;;;;5.0;5.0;5.0;nein;;;;;5.0;5.0;5.0;[False, True, False, False];[True, False, False, False];[False, True, False, False];[False, True, False, False, False, False, False];[False, True, False];[True, True, True, True, True, True, True, True, True];[False, True, False];[True, False, True, False];[True, False];[False, True];[False, True];[True, False];[False, True, False];[False, True];[False, True, False, True, False, True, False, False];[True, False, False];56.0;100.0;alles war suppi;;;;;5.0;5.0;5.0;3dLAJPXXug3EMqbc5
