pupilId;nr_tasks_per_pupil;total_duration in minutes;average duration per task in minutes;AI-1-v2-1-1;AI-4-v2-1-4;EvalML-1-1;ML-2-1-1;EvalML-1-5;AI-4-v2-1-5;EvalML-1-2;EvalML-1-6;AIClosing-1-1;AIClosing-1-3;AIClosing-1-4;AI-1-v2-1-2;AI-1-v2-1-2_skipped_answer;AI-1-v2-1-2_null_answer;AI-1-v2-1-2_correct_points;AI-1-v2-1-2_incorrect_points;AI-1-v2-1-2_irrelevant_points;AI-1-v2-1-2_rating_content;AI-1-v2-1-2_rating_format;AI-1-v2-1-2_rating_creativity;AI-4-v2-1-3;AI-4-v2-1-3_null_answer;AI-4-v2-1-3_correct_points;AI-4-v2-1-3_incorrect_points;AI-4-v2-1-3_irrelevant_points;AI-4-v2-1-3_rating_content;AI-4-v2-1-3_rating_format;AI-4-v2-1-3_rating_creativity;ML-2-1-2;ML-2-1-2_null_answer;ML-2-1-2_correct_points;ML-2-1-2_incorrect_points;ML-2-1-2_irrelevant_points;ML-2-1-2_rating_content;ML-2-1-2_rating_format;ML-2-1-2_rating_creativity;EvalML-1-7;EvalML-1-7_null_answer;EvalML-1-7_correct_points;EvalML-1-7_incorrect_points;EvalML-1-7_irrelevant_points;EvalML-1-7_rating_content;EvalML-1-7_rating_format;EvalML-1-7_rating_creativity;AIClosing-1-2;AIClosing-1-5;AIClosing-1-5_null_answer;AIClosing-1-5_correct_points;AIClosing-1-5_incorrect_points;AIClosing-1-5_irrelevant_points;AIClosing-1-5_rating_content;AIClosing-1-5_rating_format;AIClosing-1-5_rating_creativity;LimitsML-1-2;LimitsML-1-2_null_answer;LimitsML-1-2_correct_points;LimitsML-1-2_incorrect_points;LimitsML-1-2_irrelevant_points;LimitsML-1-2_rating_content;LimitsML-1-2_rating_format;LimitsML-1-2_rating_creativity;AI-2-v2-1-1;EvalML-1-4;AI-4-v2-1-1;AI-4-v2-1-2;AI-3-v2-1-2;EvalML-1-3;Classification-1-1-1;Clustering-1-1-1;ML-3-1-2;ML-3-1-3;ML-3-1-4;EvalML-1-9;Classification-2-1-8;Impact-1-1-1;EvalML-1-8;LimitsML-1-1;AIClosing-1-6;AIClosing-1-7;AIClosing-1-8;AIClosing-1-8_null_answer;AIClosing-1-8_correct_points;AIClosing-1-8_incorrect_points;AIClosing-1-8_irrelevant_points;AIClosing-1-8_rating_content;AIClosing-1-8_rating_format;AIClosing-1-8_rating_creativity;classId
Ay6mfswm3SFcQdNJg;66;120.11666666666666;1.8199494949494948;62.0;91.0;81.0;71.0;75.0;90.0;90.0;64.0;100.0;34.0;89.0;Künstliche Intelligenz ist meiner Meinung nach ein Algorithmus ergänzt um z.B. maschinelles lernen oder auch eine Anwendung welche lernt und in der Lage ist z.B. menschliches Verhalten nachzuahmen indem sie Menschen analysiert. Künstliche Intelligenz sollte meiner Meinung nach auch bereits in der Lage sein gewisse geringfügige ja/nein Entscheidungen zu treffen aber sie sollte dies nicht mit Folgen für das Leben von Menschen. Künstliche Intelligenz lernt unter anderem mit der sogenannten Methode des Deep Lernings. Hierbei werden Daten durch einen Algorithmus geschickt und von diesem ausgewertet mit Hinsicht darauf ob eine Behauptung zu diesen Daten stimmt oder nicht. Gibt der Algorithmus die Lösung richtig wieder werden die Teile der KI bei der Entscheidungsfindung verstärkt, die für die richtige Lösung sorgten. ;FALSE;FALSE;3;2;1;5.0;5.0;5.0;KI ist eine künstliche Intelligenz in einem spezifischen Bereich (zumindest heute), welche in der Lage ist eigene Entscheidungen zu treffen und aus diesen zu lernen. KI gibt es noch nicht in solchem Maße wie Menschen intelligent sind, doch spezifische KI ist Menschen in bestimmten Bereichen bereits überlegen.   ;FALSE;4;0;0;5.0;5.0;4.0;Insbesondere Deep-Learning ist mir bekannt. Beim Deep-Learning werden einem Computer verschiedene Bilder gegeben und der Computer analysiert in mehreren Schritten ob es sich um einen gewissen Fall handelt (also zum Beispiel um den Fall, dass das Bild einen Hund zeigt) oder nicht bzw. ob es sich stattdessen um z.B. eine Katze handelt statt eines Hundes. Wenn nun das Ergebnis richtig war dann werden jene Komponenten, welche zur richtigen Lösung beitragen beim nächsten Versuch stärker gewertet als andere und wenn das Ergebnis falsch war dann werden irreführende Teile des Algorithmus weniger stark gewertet.;FALSE;3;0;0;5.0;5.0;5.0;Beim maschinellen lernen werden KIs selbständig darauf trainiert bestimmte Daten zuzuordnen oder sie zu labeln. Dabei unterscheidet man  zwischen überwachtem und unüberwachtem  lernen.;FALSE;4;0;0;5.0;5.0;4.0;100.0;;;;;;;;;Auf einmal würde der Algorithmus anfangen alle Bilder von Hunden nicht mehr als Hunde zu labeln aber dafür alle Seehunde als Hunde labeln.<br>;;;;;5.0;5.0;5.0;[True, True, False, True];[True, True, True, False];[False, True, True, False];[True, True, False, True, True, False, True];[True, False, True];[True, False, False, True, False, True, False, False, True];[False, True, False];[False, False, True, True];[True, False];[False, True];[False, True];[True, True];[True, False, True];[False, True];[True, False, True, True, False, True, True, True];[True, True, False];75.0;87.0;;;;;;;;;qFEyvypMn4sAwLwtc
Z9DkQMmtiPiHtteME;4;25.95;6.4875;43.0;;;;;;;;;;;"<span style=""background-color: rgb(248, 246, 247); color: rgba(0, 0, 0, 0.87);"">kl ist ein Zweig der Informatik, der sich der Automatisierung von intelligentem Verhalten und maschinellem Lernen widmet. Der Begriff ist schwer zu definieren, da es keine genaue Definition von ""intelligent"" gibt. Trotzdem wird es immer noch in Forschung und Entwicklung eingesetzt.</span>";FALSE;TRUE;0;0;0;5.0;4.0;5.0;;;;;;;;;;;;;;;;;;;;;;;;;;;;;;;;;;;;;;;;;;[False, True, False, True];[];[];[];[];[];[];[];[];[];[];[];[];[];[];[];;;;;;;;;;;qFEyvypMn4sAwLwtc
sqBXKssFvS8pFYAMv;66;66.65;1.009848484848485;89.0;99.0;96.0;79.0;93.0;100.0;98.0;95.0;95.0;61.0;89.0;Künstliche  Intelligenz ist ein Algorithmus der trainiert oder programmiert wurde bei bestimmten Reißen oder Bedingungen bestimmte Handlungen ausführt.;FALSE;FALSE;1;1;0;4.0;4.0;4.0;Eine KI kann durch bestimmte Handlungen, selbst entscheiden was es für eine Handlung ausführen muss. Dafür hat die KI einen Algorithmus durch den sie auch selbst erweitern oder ändern kann wenn’s eine selbstlernende KI ist. Es gibt spezifische KI die z.B nur die schnellste Autoroute von A nach B berechnen können aber auch allgemeine KI die in jedem Bereich ein gewisse Intelligenz  besitzen. Solch eine allgemeine Intelligenz gibt es aber noch nicht.;FALSE;5;0;0;5.0;5.0;4.0;Maschinelles lernen ist lernen bei dem eine Maschine oder eine KI trainiert wird. Dafür braucht die sehr viele Daten und bekommt am Ende ein Feedback ob sie richtig gehandelt hat oder nicht. Mit diesem Feedback werden die Daten die zu einer Handlung führen angepasst.;FALSE;2;0;0;4.0;5.0;4.0;Maschinelles lernen ist ein Lernprozess bei dem mit großen Datenmengen eine KI trainiert wird um  mit bestimmten Handlungen zu reagieren. Es gibt dass überwachte lernen bei dem ein Algorithmus mit gekabelten Daten trainiert wurde und dann später Daten selbst Labeln kann und das unüberwachte lernen das cluster also Regelmäßigkeiten findet.;FALSE;6;0;0;5.0;4.0;4.0;93.0;Ich würde ihm sagen, dass eine KI niemals so komplex denken kann wie er selbst. Die KI wird immer nur kleine Teilbereiche gut Beherschen können. Der Mensch ist also nicht von KI bedroht sondern hat nur eine Hilfe im Alltag die einen bei Teilbereichen unterstützt.;;;;;4.0;5.0;4.0;Dann würde der Algorithmus nur Seehund als Hunde Labeln. Echte Hunde würde er nicht erkennen.;;;;;5.0;5.0;4.0;[True, True, False, True];[True, True, True, False];[False, False, True, False];[True, True, False, False, True, False, True];[False, False, True];[True, False, False, True, False, True, False, True, True];[False, True, False];[False, False, True, True];[False, True];[True, False];[False, True];[True, True];[False, False, True];[False, True];[True, False, True, True, False, True, True, True];[True, True, False];74.0;89.0;Ich fand es gut das Videos eingebunden wurden und oft nach der Meinung gefragt wurde.  Die Tipps bei den Multiple-choice Aufgaben könnten allerdings noch auf die jeweils angeklickten Antworten angepasst werden, da man oft einen Tipp zu einer Antwort bekommen hat die man bereits ausgewählt hatte.;;;;;5.0;5.0;5.0;qFEyvypMn4sAwLwtc
Kd6FuRsrq6QvPrkKp;6;37.38333333333333;6.230555555555555;78.0;;;;;;;;;;;Künstliche Intelligenz heißt, dass ein Roboter (Beziehungsweise eine Maschine) nachahnen kann und sich selbst als Mensch verhalten kann. Auch kann eine Künstgliche Intelligenz komplett selbstständig handeln, dies geschieht durch die sogenannte Automatisierung. Zum Beispiel werden Autos auf das sogenannte Autonomes Fahrsystem ungestellt, was bedeutet, dass Autos komplett selbstständig fahren und in brenzlichen Situationen selbstständig handeln.<br>;FALSE;FALSE;2;1;0;4.0;4.0;5.0;;;;;;;;;;;;;;;;;;;;;;;;;;;;;;;;;;;;;;;;;;[True, True, False, True];[];[];[];[True, False, True];[];[];[];[];[];[];[];[];[];[];[];;;;;;;;;;;qFEyvypMn4sAwLwtc
jRT6yzZ2ip5ab5ZFM;66;66.56666666666666;1.0085858585858585;90.0;88.0;76.0;71.0;69.0;72.0;100.0;93.0;51.0;53.0;57.0;KI oder besser gesagt Künstliche Inteliegenz sind Programme von Menschen erschafen die von Menschen lernen, eigenständich handeln können und sich weiter entwickeln können.;FALSE;FALSE;2;1;0;4.0;3.0;4.0;KI anwendung können eigene entscheidungen treffen und lernen durch Erfahrung Spezifische KI umfasst Anwendung, die menschenähnliche Intelligenz in einem kleinen Bereich zeigt;FALSE;3;0;0;4.0;3.0;4.0;Mir fällt grad nichts ein;TRUE;0;0;0;1.0;1.0;1.0;Beim Maschinellem Lernen, wird die KI von einen Menschen treniert sachen zu tun ;FALSE;1;0;0;4.0;2.0;5.0;58.0;KI können uns sehr im Alltag helfen und auch leben retten solange sie nicht inteliegenter als menschen sein könne.;;;;;4.0;2.0;3.0;dann würden Hunde kaum noch als Hund vom Programm erkannt werden sondern seehunden würden als Hunde gesehen werden;;;;;5.0;3.0;4.0;[True, True, False, True];[True, True, True, False];[False, True, True, False];[False, True, True, False, False, True, True];[False, False, True];[False, True, False, True, False, True, False, False, True];[False, True, True];[False, False, True, True];[False, True];[True, False];[True, False];[True, False];[True, False, True];[False, True];[True, False, False, True, True, False, True, True];[True, True, False];100.0;100.0;Ich finde dieses system mit den GMBH mega cool so kriegt man auch nen reiz die beste GMBH von allen zu sein :);;;;;5.0;5.0;5.0;qFEyvypMn4sAwLwtc
gooproPtWeTH6dtcB;66;28.683333333333334;0.4345959595959596;36.0;45.0;44.0;54.0;37.0;42.0;60.0;50.0;65.0;21.0;35.0;<h3>Meine Meinung zu Künstliche Intelligenz ist sehr prositiv auch wenn ich nicht zu viel erfahrung damit gemacht habe </h3><br>;FALSE;FALSE;0;0;1;3.0;4.0;4.0;;;;;;;;;"<span style=""color: rgb(32, 33, 36);"">Maschinelle Lernen beschreibt den Erwerb von Wissen durch ein künstliches System. Der Computer generiert hier analog wie ein Mensch selbstständig Wissen aus Erfahrungen und kann eigenständig Lösungen für neue und unbekannte Probleme finden.</span>";TRUE;0;0;0;5.0;5.0;4.0;;TRUE;0;0;0;1.0;1.0;1.0;57.0;"<span style=""color: rgb(51, 51, 51);"">⠀</span>";;;;;0.0;0.0;0.0;<span>⠀</span>;;;;;0.0;0.0;0.0;[True, True, False, True];[False, False, True, True];[False, False, True, True];[False, True, False, False, True, False, False];[False, True, False];[True, False, True, True, False, True, False, False, True];[False, False, False];[False, True, True, False];[False, True];[False, True];[True, False];[True, False];[False, False, False];[False, True];[False, False, True, False, False, True, False, True];[False, True, True];72.0;100.0;"<span style=""color: rgb(51, 51, 51);"">⠀</span>";;;;;5.0;5.0;5.0;qFEyvypMn4sAwLwtc
vNMvj2EsvKXvqk3Qw;6;19.6;3.266666666666667;5.0;;;;;;;;;;;Ich denke, künstliche Intelligenz sind Computer, die wie Menschen viel Wissen haben.;FALSE;FALSE;0;1;0;4.0;5.0;3.0;;;;;;;;;;;;;;;;;;;;;;;;;;;;;;;;;;;;;;;;;;[False, True, True, True];[];[];[];[True, False, True];[];[];[];[];[];[];[];[];[];[];[];;;;;;;;;;;qFEyvypMn4sAwLwtc
FhFN5eiQduwiYKWEn;34;88.13333333333334;2.592156862745098;73.0;92.0;;80.0;;59.0;;;;;;küstliche Inteligenz fünktuniert wie ein baby, er lernt mit bilder sprache und was auf immer bei ihm angeht für beispeil wenn ich eine computer programbilder von handy zeige und dann ihm ein bild von ein hund ein bild von ein handy zeige kann er leicht erkennen welche von die beide ein handy ist und welche ein hund.;FALSE;FALSE;1;1;0;4.0;3.0;5.0;ki bedeutet lernen durch zeichnungen, erfahrungen, feedbacks, und dann auch selbständig entscheidungen treffen, und dann durch erfahrung und fehler lernen und sich verbessern .;FALSE;2;1;0;4.0;2.0;4.0;maschinelle lernen wenn Mann der Computer keine Anforderungen gibt sondern lasst ihm selbst lernen und entwickeln;FALSE;1;1;0;3.0;4.0;4.0;;;;;;;;;;;;;;;;;;;;;;;;;;[True, True, False, True];[];[False, True, True, False];[True, True, False, True, True, False, True];[True, True, False];[];[False, True, True];[False, False, True, True];[False, True];[False, True];[False, True];[];[True, False, True];[];[];[];;;;;;;;;;;qFEyvypMn4sAwLwtc
R8CkqGDeQXZmHxTuk;27;79.18333333333334;2.9327160493827162;79.0;100.0;;73.0;;77.0;;;;;;Eine KI Ist eine Art Computer der Stelbst  in der Lage ist sachen zu machen odersich zu bewegen oder Leuten zu Helfen;FALSE;FALSE;1;0;0;4.0;3.0;3.0;Eine KI ist etwas was durch lernen  sich viele sachen aneignen kann un deswegen vieles machen kann;FALSE;1;0;0;2.0;3.0;3.0;Maschinelles Lernen ist  das mann einer KI informaton gibt und sie dadurch Lernt und einsetzen kann;FALSE;1;0;0;3.0;2.0;4.0;;;;;;;;;;;;;;;;;;;;;;;;;;[True, True, False, True];[];[True, False, True, False];[False, True, True, False, True, False, False];[False, False, True];[];[];[True, False, False, True];[False, False];[False, True];[True, False];[];[];[];[];[];;;;;;;;;;;qFEyvypMn4sAwLwtc
RCatXQL24GnNLyRcF;3;6.416666666666667;2.138888888888889;70.0;;;;;;;;;;;Künstliche Intelligenz liegt vor wenn Maschinen menschliches Verhalten nachahmen sollen, agieren sollen wie Menschen und in Zukunft auch so fühlen sollen. Ein Teilbereich ist dabei das maschinelle Lernen. Hier lernen Maschinen an vielen Wiederholungen etwas zu Erkennen oder zu tun. Menschen bringen dabei korrektes Verhalten bei und Maschinen trainieren dieses. Deep Learning geht auf neuronale Netze zurück und lässt Maschinen beispielsweise Muster in Bildern erkennen. Dabei sind diese so gut wie das Trainingsmaterial war, dass sie beim Lernen verwendet haben.;FALSE;FALSE;3;1;0;5.0;5.0;5.0;;;;;;;;;;;;;;;;;;;;;;;;;;;;;;;;;;;;;;;;;;[];[];[];[];[];[];[];[];[];[];[];[];[];[];[];[];;;;;;;;;;;qFEyvypMn4sAwLwtc
ZTvPk2i77LDC8pFmu;66;59.4;0.9;59.0;73.0;40.0;53.0;56.0;34.0;33.0;78.0;71.0;43.0;45.0;also roboter halt oder technische sachen halt ;FALSE;FALSE;0;1;0;2.0;2.0;3.0;okay, Ki umfasst meistens maschinen die von menschen gebaut worden sind, und welche auch menschliche aufgaben machen können. kis lernen aus erfahrung und treffen eigenständige Entscheidungen, bald soll Ki sogar schlauer sein als so mancher Mensch.Momentan gehören alle ki anwendungen zur spezifischen ki.Ki sind sowas wie echo dots, roboter, oder auch siri;FALSE;4;0;0;5.0;3.0;4.0;das heißt eigtl. nur das eine maschine aus erfahrung lernt;FALSE;1;0;0;3.0;2.0;3.0;eine maschine lernt aus erfahrung, z.b. bei der erkennung von hunden sieht es bilder von mehrerehn hunden und kann so besser hunde erkennen;FALSE;2;0;0;5.0;3.0;4.0;61.0;Bisher wird ja KI noch nicht so stark eingesetzt dass man sich sorgen müsste, außerdem lernen die ja auch aus erfahrung, d.h., dass KI später kaum Fehlentscheidungen treffen wird, und auf jeden fall weniger als der mensch. Also eigtl gibt es keinen grund zur Sorge;;;;;4.0;3.0;4.0;dann würde der computer bei seehunden sagen dass das hunde sind<br>;;;;;5.0;2.0;4.0;[False, False, False, True];[True, False, True, False];[False, True, True, False];[True, False, False, False, True, False, True];[False, True, True];[True, False, False, True, True, True, False, True, True];[False, True, False];[False, False, True, True];[False, True];[True, False];[False, True];[True, True];[True, False, True];[False, True];[True, False, True, True, False, False, True, True];[True, True, True];61.0;64.0;Die Aufgaben waren zu schwer, und ab und zu gab es fehler bei der auswertung, aber sonst war es nice.;;;;;5.0;5.0;5.0;qFEyvypMn4sAwLwtc
bniRycMi5bwrXjvGy;66;70.23333333333333;1.064141414141414;92.0;95.0;95.0;66.0;81.0;100.0;100.0;54.0;88.0;64.0;100.0;Künstliche Intelligenz ist ein Algorithmus, der immer weiter dazu lernt um Aufgaben in den verschiedenste Bereichen zu erledigen.;FALSE;FALSE;1;0;0;3.0;5.0;4.0;Eine KI ist ein Algorithmus, der auf eine bestimmte Aufgabe spezialisiert ist. Das nennt man die spezifische Intelligenz. Eine KI die allgemeine Intelligenz aufweist (wie der Mensch) gibt es noch nicht. KI treffen basierten auf ihrem Algorithmus eigene Entscheidungen und lernen auf Basis dieser dazu. Die KI ist bereits in vielen Teil des Alltags vertreten (Sprachassistenten, Kühlschränken, Smartphones).;FALSE;5;0;0;5.0;5.0;5.0;Beim maschinellen Lernen wird der Algorithmus „trainiert“. Hier werden dem Algorithmus viele Bilder von (in unserem Fall) Hunden oder anderen Tieren gezeigt. Wenn er das Tier fälschlicherweise als Hund erkennt, verändert er die Gewichtung der Merkmale. Wenn er einen Hund als Hund erkennt, stärkt er die Gewichtung. Der Algorithmus wird also mit Daten gefüttert und erhält dann ein Feedback.;FALSE;3;0;0;4.0;5.0;4.0;Beim maschinellen Lernen wird die KI mit Beispielen gefüttert und dadurch trainiert. ;FALSE;1;0;0;5.0;5.0;4.0;100.0;Ich glaube, dass meine Angst haben brauch, da meiner Meinung nach Menschen immer überlegen werden sein.;;;;;4.0;2.0;4.0;Dann würde der Algorithmus denken, dass Hunde aussehen wie Seehunde. Also würde er dann Seehunde als Hunde erkennen und benennen;;;;;5.0;5.0;4.0;[True, True, False, True];[True, True, True, False];[False, True, True, False];[True, True, False, True, True, False, True];[True, False, True];[True, False, False, True, False, True, False, True, True];[False, True, False];[False, False, True, True];[False, True];[True, False];[False, True];[True, True];[True, False, True];[False, True];[True, False, True, True, False, True, True, True];[True, True, False];55.0;73.0;War alles gut.;;;;;5.0;5.0;5.0;qFEyvypMn4sAwLwtc
rsATbrReo6odn6oXD;34;67.91666666666667;1.9975490196078434;74.0;84.0;;57.0;;100.0;;;;;;"Künstliche Intelligenz ist quasi der Verstand von einem Computer. Hierbei kann ein Computer Entscheidungen treffen, die auf dem ,,gelernten Wissen"" des Computers basieren. Lernen tut der Computer, in dem er verschiedene Merkmale von Gegenständen einprägt und Verbindungen zwischen diesen bildet. KI kann in modernen Autos, in Videospielen oder in Robotern gefunden werden.";FALSE;FALSE;3;1;0;4.0;5.0;4.0;KI ist eine programmierte Intelligenz, die in einzelnen Bereichen eigenständige Entscheidungen treffen kann. Diese Entscheidungen basieren auf Erfahrungen, die entweder programmiert, oder bereits gesammelt wurden. Diese Intelligenz ist aber immer nur in ihrem programmierten Bereich aktiv, da es noch keine allgemeine KI gibt.;FALSE;4;0;0;5.0;5.0;4.0;Computer lernen, in dem sie Merkmale eines Bildes abspeichern, und zwischen den Merkmalen Verbindungen ziehen. Bei weiteren Bildern sucht der Computer nach diesen Merkmalen. Wenn der Computer bei einem Bild richtig lag, verstärkt er diese Verbindungen, wenn er falsch lag, löst er sie auf. So entstehen nach und nach die typischen Merkmale einer Katze zum Beispiel.;FALSE;1;1;0;5.0;5.0;4.0;;;;;;;;;;;;;;;;;;;;;;;;;;[True, True, True, True];[];[False, True, True, False];[True, True, False, True, True, False, True];[False, False, True];[];[False, True, False];[False, True, True, True];[False, True];[False, True];[False, True];[];[True, True, True];[];[];[];;;;;;;;;;;qFEyvypMn4sAwLwtc
7eqvpzMXwFGaYWHou;11;43.8;3.9818181818181815;69.0;53.0;;;;43.0;;;;;;"<span style=""background-color: rgb(232, 234, 246); color: rgba(0, 0, 0, 0.87);"">Künstliche Intelligenz (KI) ist in Reichweite. Menschen im philosophischen Sinne sind mit den möglichen Zukunftsszenarien der menschlichen Gesellschaft unzufrieden - nicht ohne einige Doomsday-Bilder zu verwenden. Berühmte Ereignisse wie der Sieg der künstlichen Intelligenz AlphaGo gegen Lee Se-dol, den Weltmeister von Go im Jahr 2016, haben ein Bild der KI gemalt, das den Menschen immer mehr übertreffen soll.</span>";FALSE;TRUE;0;0;0;4.0;3.0;5.0;Eine KI ist eine CPU die kein Mensch ist. Die KI gibt es nur in Computern;FALSE;0;1;1;2.0;4.0;3.0;;;;;;;;;;;;;;;;;;;;;;;;;;;;;;;;;;[True, True, False, True];[];[False, True, True, False];[True, False, True, False, False, True, True];[True, True, False];[];[];[];[];[];[];[];[];[];[];[];;;;;;;;;;;qFEyvypMn4sAwLwtc
dotjrftFetJme4iPH;35;117.25;3.35;76.0;49.0;;54.0;;88.0;;;;;;Meiner Meinung nach, künstliche Intelligenz ist das „Deep–Learning“, welches den Maschinen ermöglicht, das menschliche Denken nachzuahmen. Das sogenannte „Deep–Learning“ ist ein Prozess, wobei die Maschinen Bilder nach ihrer Pixel Auflösung und nach Kategorie analysieren.;FALSE;FALSE;1;2;1;4.0;5.0;4.0;KIs sind Maschinen, die bezüglich im Alltag verwendet werde, wie Alexa, Siri, Gesichtserkennung, usw.. Allerdings gibt es auch Roboter, die das menschliche Verhalten und das logische Denken nachahmen, indem sie durch Erfahrungen bzw. durch das Ansehen von Angaben auf andere Sachen anwenden können.;FALSE;2;1;0;5.0;5.0;4.0;Ich denke, dass maschinelles Lernen ein Prozess von den Computern ist, indem sie durch das ständige analysieren von Bildern von Hunde und Katzen am Schluss wichtige Eigenschaften erlernen. ;FALSE;1;1;0;5.0;5.0;4.0;;;;;;;;;;;;;;;;;;;;;;;;;;[True, True, False, True];[];[False, True, True, False];[False, True, False, True, True, False, True];[False, True, True];[];[False, True, False];[False, False, True, True];[True, False];[False, True];[False, True];[];[True, False, True];[];[];[];;;;;;;;;;;qFEyvypMn4sAwLwtc
TLqNCrX4jaYixjtv7;46;124.0;2.6956521739130435;51.0;61.0;66.0;53.0;75.0;100.0;100.0;100.0;;;;Künstliche Intelligenz ist wenn Programme durch das Deep-learning Verfahren Dinge erkennen kann und den Menschen z.B. helfen, objektiv zu bewerten. KI wird beispielsweise für Autonomes Fahren, Pflegeroboter  und Erkennen einer Lungeninfektion auf der Computertomografie genutzt. Allerdings wird KI auch sehr kritisiert, da Roboter keine Entscheidungen treffen sollen und auch bei den Pflegerobotern, weil sie nicht wirklich Gefühle besitzen, sondern diese Gefühle nur durch einem Bildschirm vortäuschen. ;FALSE;FALSE;2;0;1;5.0;5.0;5.0;Es gibt spezifische KI und die Vorstellung von allgemeine KI. Spezifische zeigen menschenähnliche Intelligenz in einem kleinen Bereich und allgemeine KI zeigen menschenähnliche Intelligenz in alle Bereiche. Allerdings gibt es noch keine allgemeine KI. KI lernen durch Erfahrung in einem Deeplearning-prozess;FALSE;6;0;0;3.0;5.0;4.0;Maschinelles Lernen, auch Deep-learning genannt hat drei Schichten, jeweils für Helligkeit, Ecken und Kanten und Muster. Wenn dem Computer Daten zugeschickt wird, gehen die Daten durch die drei Schichten. Am Ende entscheidet der Computer, ob zB. auf einem Bild ein Hund gezeigt wird. ;FALSE;2;0;0;5.0;5.0;4.0;Es gibt überwachtes Lernen und unüberwachtes Lernen. Überwachtes Lernen ist wenn die Trainingsdaten mit Label beschriftet werden und der Algorithmus am Ende selbst Bilder mit Label beschriften kann. Beim unüberwachten Lernen werden die Daten in verschiedene Cluster unterteilt, es findet Struktur in den Daten.;FALSE;5;0;0;4.0;5.0;4.0;;;;;;;;;;Dann erkennt der Algorithmus Seehunde als Hunde.;;;;;5.0;5.0;5.0;[True, True, False, True];[True, False, True, False];[False, True, True, False];[False, True, True, True, True, False, True];[True, False, True];[True, True, False, True, False, True, False, False, True];[False, True, False];[False, False, True, True];[False, True];[False, True];[False, True];[True, True];[True, False, True];[];[True, False, True, True, False, True, True, True];[True, True, False];;;;;;;;;;;qFEyvypMn4sAwLwtc
hn2oJ5p2CwPfG44wx;54;123.0;2.2777777777777777;71.0;99.0;79.0;77.0;100.0;100.0;84.0;100.0;;;;Bei Künstlichen Intelligenzen wird durch das Deep Learning (dies kann z.B. über Pixel Registrierungen bei Bildern funktionieren, wenn es um Bilderkennung handelt) versucht, Computern die Fähigkeit zu verleihen menschlich zu denken und zu lernen.;FALSE;FALSE;1;0;0;4.0;5.0;5.0;Es gibt zwei Arten von KIs einmal die spezifische KI und einmal die allgemeine KI. Die allgemeine KI ist in allen Bereichen gut und ist demnach auf einer Leistungshöhe mit dem Menschen. Eine spezifische KI ist jedoch nur in einer spezifischen Aufgabe gut.Anwendungen, die sich an etwas anpassen und selbst Entscheidungen treffen, gehören zur KI. ;FALSE;5;0;0;4.0;5.0;4.0;"Maschinelles Lernen wird auch ""deep learning"" genannt. Dabei lernt das Computer durch Erfahrungen in einem bestimmten Bereich. Wenn man möchte das ein Computer Katzen erkennen kann, legt man ihm viele verschiedene Katzen Bilder vor. Dann erkennt er alle Ecken, Kanten und typische Formen, wie Nase, Ohren. Durch häufige Wiederholungen lernt der Computer dann, auch von anderen Bildern Katzen zu erkennen. ";FALSE;3;1;0;5.0;5.0;4.0;Maschinelles Lernen ist Lernen durch Erfahrungen. Dabei werden Algorithmen zum Beispiel viele verschiedene Bilder mit bestimmten Objekten oder Lebewesen vorgelegt, damit es lernt auch von anderen Bildern sie zu erkennen. ;FALSE;1;0;1;5.0;5.0;3.0;;;;;;;;;;Dann würde das Algorithmus nur Seehunde als Hunde ansehen, echte Hunde jedoch nicht.;;;;;5.0;5.0;5.0;[True, True, False, True];[True, False, True, False];[False, True, True, False];[True, True, False, False, True, True, True];[True, False, True];[True, True, False, True, False, True, False, False, True];[False, True, False];[False, False, True, True];[False, True];[False, True];[False, True];[True, True];[True, False, True];[False, True];[False, True, True, True, False, True, True, True];[True, True, False];;;;;;;;;;;qFEyvypMn4sAwLwtc
