778,jRT6yzZ2ip5ab5ZFM,qFEyvypMn4sAwLwtc,AI-4-v2-1-3,AI-4-v2,195,"KI anwendung können eigene entscheidungen treffen und lernen durch Erfahrung Spezifische KI umfasst Anwendung, die menschenähnliche Intelligenz in einem kleinen Bereich zeigt",True,freetext,correct,,,"{'content': 4, 'format': 3, 'creativity': 4}",,"Jetzt weißt du schon mehr über KI. Sag nochmal in eigenen Worten, was KI ist. Denk dabei an die Eigenschaften, durch die sich KI-Anwendungen auszeichnen und die verschiedenen Arten von KIs.",,,,,"KI-Anwendungen zeichnen sich aus durch intelligentes Verhalten, das Treffen eigenständiger Entscheidungen und dem Lernen mittels Erfahrung. Man unterscheidet spezifische und allgemeine KI, wobei die spezifische KI intelligentes Verhalten in nur einem kleinen Bereich der Intelligenz zeigt. Alle bisherigen KI-Anwendungen gehören zur spezifischen KI. Allgemeine Intelligenz haben diese nicht.",22.0,4.0,3.0,4.0
779,jRT6yzZ2ip5ab5ZFM,qFEyvypMn4sAwLwtc,AI-4-v2-1-4,AI-4-v2,8,88,True,surveySlider,,,,,,"Wie gut hast du jetzt verstanden, was KI ist?",,Gar nicht,Sehr gut,,,,,,
780,jRT6yzZ2ip5ab5ZFM,qFEyvypMn4sAwLwtc,AI-4-v2-1-5,AI-4-v2,8,72,True,surveySlider,,,,,,Wie gut hast du den Unterschied zwischen spezifischer und allgemeiner KI verstanden?,,Gar nicht,Sehr gut,,,,,,
781,jRT6yzZ2ip5ab5ZFM,qFEyvypMn4sAwLwtc,ML-1-1-1,ML-1,245,"Es ist ein Hund, wenn es ein Tier mit Leine istEs ist ein Hund, wenn es eine längliche schnauze hat Es ist ein Hund, wenn es 4 Pfoten hatEs ist ein Hund, wenn es einen Schwanz hat Es ist ein Hund, wenn es Bellen kann <br>",True,freetext,correct,,,"{'content': 4, 'format': 5, 'creativity': 4}",,"Kannst du einen Algorithmus schreiben, der Hunde auf Bildern erkennt? Überlege dir vorher was einen Hund ausmacht. Nutze Regeln wie “Es ist ein Hund, wenn es vier Pfoten hat.” oder “Es ist ein Hund, wenn es ein Tier mit Leine ist.”",,,,,"Die SuS sollen sinnvolle Wenn-Dann-Regeln finden, die beschreiben, wie Hunde auf Bildern erkannt werden können.",46.0,4.0,5.0,4.0
782,jRT6yzZ2ip5ab5ZFM,qFEyvypMn4sAwLwtc,ML-1-1-2,ML-1,35,"[0, 1, 0]",True,survey,,,,,,"Oft ist es schwierig, mit ein paar Regeln alle Fälle zu bedenken. Würden deine Regeln die folgenden Fälle richtig erkennen? Einen Hund mit 3 Beinen.","[{'de': 'Als Hund.', 'en-US': 'As a dog.'}, {'de': 'Nicht als Hund.', 'en-US': 'Not as a dog.'}]",,,,,,,,
783,jRT6yzZ2ip5ab5ZFM,qFEyvypMn4sAwLwtc,ML-1-1-3,ML-1,12,"[1, 0, 0]",True,survey,,,,,,Einen Nackthund (Hundeart ohne Fell)?,"[{'de': 'Als Hund.', 'en-US': 'As a dog.'}, {'de': 'Nicht als Hund.', 'en-US': 'Not as a dog.'}]",,,,,,,,
784,jRT6yzZ2ip5ab5ZFM,qFEyvypMn4sAwLwtc,ML-1-1-4,ML-1,9,"[0, 0, 1]",True,survey,,,,,,Eine Katze?,"[{'de': 'Als Hund.', 'en-US': 'As a dog.'}, {'de': 'Nicht als Hund.', 'en-US': 'Not as a dog.'}]",,,,,,,,
785,jRT6yzZ2ip5ab5ZFM,qFEyvypMn4sAwLwtc,ML-2-1-1,ML-2,26,71,True,surveySlider,,,,,,"Wie gut weißt du schon, was Maschinelles Lernen ist?",,Gar nicht,Sehr gut,,,,,,
786,jRT6yzZ2ip5ab5ZFM,qFEyvypMn4sAwLwtc,ML-2-1-2,ML-2,32,Mir fällt grad nichts ein,True,freetext,correct,,,"{'content': 1, 'format': 1, 'creativity': 1}",,"Weißt du vielleicht schon etwas über das maschinelle Lernen? Es ist gar nicht schlimm, wenn das noch nicht der Fall ist. Dann schreib einfach, dass du noch nichts weißt.",,,,,"Das ist nur eine Abfrage, um über das Vorwissen der SuS bescheid zu wissen. Es ist nicht schlimm, wenn sie noch nichts wissen.",5.0,1.0,1.0,1.0
787,jRT6yzZ2ip5ab5ZFM,qFEyvypMn4sAwLwtc,ML-2-1-3,ML-2,144,"[True, False, True, True]",True,multipleChoice,correct,,,,,Lass uns das Wichtigste nochmal wiederholen:,"[{'de': 'Unser Ziel ist es, einen Algorithmus zu trainieren, der für neue Bilder das richtige Label vorhersagen kann. Also zu sagen, ob ein Bild einen Hund oder eine Katze zeigt', 'en-US': 'Our goal is to train an algorithm that can predict the correct label for new images. That is, to tell whether an image shows a dog or a cat'}, {'de': 'Für das Training nutzen wir Daten ohne Label', 'en-US': 'For training we use data without label'}, {'de': 'Die Daten, die wir für das Training benutzen, heißen Trainingsdaten', 'en-US': 'The data we use for training is called training data'}, {'de': 'Nach dem Training testen wir nochmal auf ein paar neuen Daten, wie gut die Vorhersagen des Algorithmus sind', 'en-US': 'After training, we test again on some new data how good the predictions of the algorithm are'}]",,,"Wenn du bei einer Antwort nicht weiter weißt, dann schau doch nochmal im Text nach.","[True, False, True, True]",,,,
788,jRT6yzZ2ip5ab5ZFM,qFEyvypMn4sAwLwtc,ML-3-1-1,ML-3,213,"[True, True, True, False]",True,multipleChoice,correct,"[[False, False, True, False], [False, True, True, False], [False, True, True, False], [False, True, True, True], [True, False, True, False]]",1,,,Welche Aussagen stimmen?,"[{'de': 'Maschinelles Lernen ist ein Teilbereich der KI', 'en-US': 'Machine learning is a subfield of AI'}, {'de': 'Das maschinelle Lernen beschäftigt sich mit Programmen, die selbständig in großen Datenmengen Gesetzmäßigkeiten erkennen können', 'en-US': 'Machine learning deals with programs that can independently recognize regularities in large amounts of data'}, {'de': 'Das überwachte und das unüberwachte Lernen unterscheiden sich zum Beispiel daran, dass wir einmal Daten mit und einmal Daten ohne Label nutzen', 'en-US': 'One difference between supervised and unsupervised learning is whether we use labeled data'}, {'de': 'Beim unüberwachten Lernen wollen wir lernen, für neue Daten das richtige Label vorherzusagen', 'en-US': 'In unsupervised learning, we want to learn to predict the correct label for new data'}]",,,Lies die Antworten ganz genau durch.,"[True, True, True, False]",,,,
789,jRT6yzZ2ip5ab5ZFM,qFEyvypMn4sAwLwtc,ML-3-1-2,ML-3,15,"[True, False]",True,multipleChoice,correct,"[[False, True]]",,,,"Ein Empfehlungssystem für Musik, das lernt, was du für Musik magst und dann für neu erscheinende Musik voraussagt, ob du sie mögen würdest.","[{'de': 'Überwachtes Lernen', 'en-US': 'Supervised Learning'}, {'de': 'Unüberwachtes Lernen', 'en-US': 'Unsupervised Learning'}]",,,,"[True, False]",,,,
790,jRT6yzZ2ip5ab5ZFM,qFEyvypMn4sAwLwtc,ML-3-1-3,ML-3,13,"[True, False]",True,multipleChoice,correct,,,,,"Die Gesichtserkennung von deinem Handy. Anfangs musst du dein Gesicht aus verschiedenen Winkeln filmen. Anhand dieser Beispiele lernt es, dein Gesicht zu erkennen. Wenn dann irgendein Gesicht versucht, dein Handy zu entsperren, kann es voraussagen, ob es dein Gesicht ist oder nicht.","[{'de': 'Überwachtes Lernen', 'en-US': 'Supervised Learning'}, {'de': 'Unüberwachtes Lernen', 'en-US': 'Unsupervised Learning'}]",,,,"[True, False]",,,,
791,jRT6yzZ2ip5ab5ZFM,qFEyvypMn4sAwLwtc,ML-3-1-4,ML-3,11,"[False, True]",True,multipleChoice,correct,"[[True, False]]",,,,Wenn wir Youtuber nach der Anzahl ihrer Follower und der Themen ihrer Videos gruppieren.,"[{'de': 'Überwachtes Lernen', 'en-US': 'Supervised Learning'}, {'de': 'Unüberwachtes Lernen', 'en-US': 'Unsupervised Learning'}]",,,,"[False, True]",,,,
792,jRT6yzZ2ip5ab5ZFM,qFEyvypMn4sAwLwtc,Classification-1-1-1,Classification-1,26,"[False, True, False]",True,multipleChoice,correct,"[[False, True, True]]",1,,,Welche Aussagen stimmen?,"[{'de': 'Beim überwachten Lernen braucht man Daten ohne Label', 'en-US': 'In supervised learning, you need data without a label'}, {'de': 'Einen Algorithmus zu trainieren, der Bildern mit Hunden das Label “Hund” gibt, wäre ein Fall für überwachtes Lernen', 'en-US': 'Training an algorithm to give the label ""dog"" to images with dogs would be a case for supervised learning'}, {'de': 'Beim überwachten Lernen versucht man Struktur in Daten zu finden', 'en-US': 'In supervised learning, one tries to find structure in data'}]",,,Lies die Antworten ganz genau.,"[False, True, False]",,,,
793,jRT6yzZ2ip5ab5ZFM,qFEyvypMn4sAwLwtc,Clustering-1-1-1,Clustering-1,19,"[False, False, True, True]",True,multipleChoice,correct,,,,,Was war unüberwachtes Lernen noch gleich?,"[{'de': 'Beim unüberwachten Lernen nutzt man Daten mit Label', 'en-US': 'In unsupervised learning, one uses data with label'}, {'de': 'Beim unüberwachten Lernen wollen wir die richtigen Label für neue Daten vorhersagen', 'en-US': 'In unsupervised learning, we want to predict the correct labels for new data'}, {'de': 'Beim unüberwachten Lernen hat man keine Label für die Daten', 'en-US': ""In unsupervised learning, you don't have a label for the data""}, {'de': 'Beim unüberwachten Lernen geht es darum, Struktur in den Daten zu finden', 'en-US': 'Unsupervised learning is about finding structure in the data'}]",,,Hier geht es nicht um überwachtes Lernen!,"[False, False, True, True]",,,,
794,jRT6yzZ2ip5ab5ZFM,qFEyvypMn4sAwLwtc,Clustering-1-1-2,Clustering-1,57,"[True, False]",True,multipleChoice,correct,"[[False, True]]",,,,Welche Aussagen über die anderen beiden Cluster stimmen?,"[{'de': 'Die Youtuber im roten Cluster laden öfter Videos hoch', 'en-US': 'The Youtubers in the red cluster upload videos more often'}, {'de': 'Die Youtuber im blauen Cluster laden öfter Videos hoch', 'en-US': 'The Youtubers in the blue cluster upload videos more often'}]",,,,"[True, False]",,,,
795,jRT6yzZ2ip5ab5ZFM,qFEyvypMn4sAwLwtc,Clustering-1-1-3,Clustering-1,126,8,True,inputField,correct,"['3', '3']",1,,,Wie viele Youtuber sind sowohl sehr aktiv als auch beliebt?,,,,In welchem Cluster sind die beliebtesten und aktivsten Youtuber?,8,,,,
796,jRT6yzZ2ip5ab5ZFM,qFEyvypMn4sAwLwtc,Clustering-1-1-4,Clustering-1,47,7,True,inputField,correct,"['2', '3']",1,,,"Wie viele Youtuber sind aktiv, haben aber nicht so viele Views?",,,,"Welche Gruppe hat viele Uploads, aber nicht so viele Views? Wie viele Youtuber sind in diesem Cluster?",7,,,,
797,jRT6yzZ2ip5ab5ZFM,qFEyvypMn4sAwLwtc,Classification-2-1-1,Classification-2,95,1,True,inputField,correct,,,,,Wie viele Filme stimmen zwischen Josi und Alex überein? Gib die Zahl in dieses Feld ein.,,,,,1,,,,
798,jRT6yzZ2ip5ab5ZFM,qFEyvypMn4sAwLwtc,Classification-2-1-2,Classification-2,17,1,True,inputField,correct,,,,,Wie viele Filme stimmen zwischen Paul und Alex überein?,,,,,1,,,,
799,jRT6yzZ2ip5ab5ZFM,qFEyvypMn4sAwLwtc,Classification-2-1-3,Classification-2,19,3,True,inputField,correct,,,,,Wie viele Filme stimmen zwischen Mahmud und Alex überein?,,,,,3,,,,
800,jRT6yzZ2ip5ab5ZFM,qFEyvypMn4sAwLwtc,Classification-2-1-4,Classification-2,17,1,True,inputField,correct,,,,,Wie viele Filme stimmen zwischen Anna und Alex überein?,,,,,1,,,,
801,jRT6yzZ2ip5ab5ZFM,qFEyvypMn4sAwLwtc,Classification-2-1-5,Classification-2,22,1,True,inputField,correct,,,,,Wie viele Filme stimmen zwischen Isa und Alex überein?,,,,,1,,,,
802,jRT6yzZ2ip5ab5ZFM,qFEyvypMn4sAwLwtc,Classification-2-1-6,Classification-2,14,"[False, False, True, False, False]",True,multipleChoice,correct,,,,,Wer hat den ähnlichsten Filmgeschmack zu Alex?,"[{'de': 'Josi', 'en-US': 'Josi'}, {'de': 'Paul', 'en-US': 'Paul'}, {'de': 'Mahmud', 'en-US': 'Mahmud'}, {'de': 'Anna', 'en-US': 'Anna'}, {'de': 'Isa', 'en-US': 'Isa'}]",,,Wer hatte die meisten Übereinstimmungen mit Alex?,"[False, False, True, False, False]",,,,
803,jRT6yzZ2ip5ab5ZFM,qFEyvypMn4sAwLwtc,Classification-2-1-7,Classification-2,40,"[False, False, True, False, False]",True,multipleChoice,correct,"[[False, False, False, False, True]]",1,,,Welchen Film kannst du Alex guten Gewissens empfehlen?,"[{'de': 'James Bond', 'en-US': 'James Bond'}, {'de': 'Herr der Ringe', 'en-US': 'Lord of the Rings'}, {'de': 'Avengers Endgame', 'en-US': 'Avengers Endgame'}, {'de': 'Fluch der Karibik', 'en-US': 'Pirates of the Caribbean'}, {'de': 'Hangover', 'en-US': 'Hangover'}]",,,Welchen Film hat Mahmud zuletzt geschaut?,"[False, False, True, False, False]",,,,
804,jRT6yzZ2ip5ab5ZFM,qFEyvypMn4sAwLwtc,Classification-2-1-8,Classification-2,55,"[True, False, True]",True,multipleChoice,correct,,,,,Welche Aussagen stimmen?,"[{'de': 'Ein Algorithmus, der dir basierend auf deinen Lieblingsfächern einen Beruf vorschlägt, könnte man mittels überwachtem Lernen umsetzen', 'en-US': 'An algorithm that suggests a profession based on your favorite subjects could be implemented using supervised learning'}, {'de': 'Ein Algorithmus, der ähnliche Berufe gruppiert, gehört zum überwachten Lernen', 'en-US': 'An algorithm that groups similar occupations is part of supervised learning'}, {'de': 'Ein Algorithmus, der anhand vieler alter Fälle gelernt hat, medizinische Diagnosen zu stellen, gehört zum überwachten Lernen', 'en-US': 'An algorithm that has learned to make medical diagnoses based on many old cases is part of supervised learning'}]",,,"Denk daran, dass wir beim überwachten Lernen Label voraussagen. Welcher dieser Algorithmen sagt ein Label voraus?","[True, False, True]",,,,
805,jRT6yzZ2ip5ab5ZFM,qFEyvypMn4sAwLwtc,Clustering-2-1-1,Clustering-2,350,Cluster 1 würde am ehesten Make-up kaufen da Beauty und Vlogs Youtuberinen auch etwas in ihren Videos mit Make-up machen würden und ihre Viewer nur Frauen sind.<br>Für Autos wäre am besten Cluster 2 und 5 da Gaming oft mals auch mit Autos was zu tun wie Forza Horizen 4 oder Grand Turismo sport und bei den Cluster 5 wär es z.B Rally Deshalb sind meistens die zuschauer auch Fans von Autos oder Rally cars.<br>,True,freetext,correct,,,"{'content': 4, 'format': 4, 'creativity': 4}",,"Schau dir die Mittelpunkte der Cluster genau an. Welches Cluster repräsentiert am ehesten eine Make-Up-Marke? Und die Zuschauer welches Clusters würden am ehesten Autos kaufen? Beschreibe in 4-5 Sätzen, welche Cluster du jeweils gewählt hast und warum diese Youtuber die perfekten Markenbotschafter dafür wären.",,,,,"Make-Up: Cluster 1 repräsentiert es am besten. Ist bereits Thema und die Zuschauer sind die richtig Zielgruppe. Autos: Cluster 3-6 wären alle alt genug. Alle wären möglich, käme auf das Auto an. Cluster 4 zB eher Familienautos, 5 und 6 eher günstige Kleinwagen und Cluster 3 auch teurere Autos.",74.0,4.0,4.0,4.0
806,jRT6yzZ2ip5ab5ZFM,qFEyvypMn4sAwLwtc,LimitsML-1-1,LimitsML,58,"[True, True, False]",True,multipleChoice,correct,,,,,"Was könnte passieren, wenn wir bei den Hundebildern nur Bilder von einer Hunderasse nutzen würden?","[{'de': 'Der Algorithmus würde nur Hunde dieser Rasse zuverlässig als Hunde erkennen', 'en-US': 'The algorithm would only reliably recognize dogs of this breed as dogs'}, {'de': 'Bei Hunden anderer Rassen ist es schwer zu sagen, ob er sie erkennen würde, aber sehr wahrscheinlich nicht so zuverlässig', 'en-US': ""With other breed dogs, it's hard to say if he would recognize them, but most likely not as reliably""}, {'de': 'Der Algorithmus würde immer noch alle Hunderassen als Hunde erkennen, weil es keine Katzen sind', 'en-US': 'The algorithm would still recognize all dog breeds as dogs because they are not cats'}]",,,,"[True, True, False]",,,,
807,jRT6yzZ2ip5ab5ZFM,qFEyvypMn4sAwLwtc,LimitsML-1-2,LimitsML,75,dann würden Hunde kaum noch als Hund vom Programm erkannt werden sondern seehunden würden als Hunde gesehen werden,True,freetext,correct,,,"{'content': 5, 'format': 3, 'creativity': 4}",,"Was würde passieren, wenn wir alle Bilder von Hunden durch Bilder von Seehunden ersetzen würden, diese aber als Hunde labeln?",,,,,"Der Algorithmus würde lernen, Seehunde auf unseren Bildern zu erkennen, ihnen aber das Label “Hund” geben.",18.0,5.0,3.0,4.0
808,jRT6yzZ2ip5ab5ZFM,qFEyvypMn4sAwLwtc,EvalML-1-1,EvalML,10,76,True,surveySlider,,,,,,"Wie gut hast du verstanden, was KI ist? Sei dabei so ehrlich es geht damit wir diese Inhalte noch verbessern können.",,Gar nicht,Sehr gut,,,,,,
809,jRT6yzZ2ip5ab5ZFM,qFEyvypMn4sAwLwtc,EvalML-1-2,EvalML,8,100,True,surveySlider,,,,,,Wie gut hast du den Unterschied zwischen spezifischer und allgemeiner KI verstanden?,,Gar nicht,Sehr gut,,,,,,
810,jRT6yzZ2ip5ab5ZFM,qFEyvypMn4sAwLwtc,EvalML-1-3,EvalML,74,"[True, False, False, True, False, True, False, False, True]",True,multipleChoice,false,"[[False, True, False, True, False, True, False, False, True], [True, True, False, True, False, True, False, False, True]]",,,,Welche der Aussagen stimmen?,"[{'de': 'KI-Anwendungen zeichnen sich dadurch aus, dass sie intelligentes Verhalten zeigen, autonom funktionieren und mit Erfahrung lernen', 'en-US': 'AI applications are characterized by exhibiting intelligent behavior, functioning autonomously, and learning with experience'}, {'de': 'Eine fertige KI-Anwendung kann nicht ohne Hilfe von einem Menschen funktionieren', 'en-US': 'A finished AI application cannot function without help from a human'}, {'de': 'Eine fertige KI-Anwendung kann nicht mit Erfahrung lernen, sie bleibt, wie sie ist', 'en-US': 'A ready-made AI application cannot learn with experience, it remains as it is'}, {'de': 'Eine spezifische KI zeigt intelligentes Verhalten in einem kleinen Bereich', 'en-US': 'A specific AI exhibits intelligent behavior in a small domain'}, {'de': 'Jede KI hat allgemeine Intelligenz. Damit ist jede KI eine allgemeine KI', 'en-US': 'Every AI has general intelligence. Thus every AI is a general AI'}, {'de': 'Ein Programm, dass so gut Schach spielen kann, wie Menschen, ist ein Beispiel für eine spezifische KI', 'en-US': 'A program that can play chess as well as humans is an example of a specific AI'}, {'de': 'Derzeit gibt es sowohl Anwendungen, die zur spezifischen, als auch welche, die zur allgemeinen KI gehören', 'en-US': 'Currently, there are applications that belong to specific AI as well as those that belong to general AI'}, {'de': 'KI kann irgendwann alles besser als der Mensch', 'en-US': 'AI will eventually be able to do everything better than humans'}, {'de': 'Jeder Mensch wird zukünftig eine Vielzahl verschiedener KIs in seinem Alltag nutzen', 'en-US': 'In the future, everyone will use a variety of different AIs in their everyday lives'}]",,,,"[True, False, False, True, False, True, False, False, True]",,,,
811,jRT6yzZ2ip5ab5ZFM,qFEyvypMn4sAwLwtc,EvalML-1-4,EvalML,37,"[True, False, True, False]",True,multipleChoice,correct,"[[True, True, True, False]]",1,,,Welche der folgenden Anwendungen enthalten KI-Methoden?,"[{'de': 'Die Erkennung von Gegenständen auf Bildern', 'en-US': 'The recognition of objects in images'}, {'de': 'Das Sortieren von Bildern nach Datum', 'en-US': 'Sorting images by date'}, {'de': 'Ein personalisiertes Empfehlungssystem für Musik', 'en-US': 'A personalized recommendation system for music'}, {'de': 'Eine Nachrichtenseite, die jedem Nutzer den gleichen Inhalt präsentiert', 'en-US': 'A news site that presents the same content to every user'}]",,,"Denk an die drei Eigenschaften, die KI-Anwendungen ausmachen: intelligentes Verhalten, Lernen mit Erfahrung und Selbständigkeit.","[True, False, True, False]",,,,
812,jRT6yzZ2ip5ab5ZFM,qFEyvypMn4sAwLwtc,EvalML-1-5,EvalML,9,69,True,surveySlider,,,,,,"Wie gut hast du verstanden, was maschinelles Lernen ist? Sei dabei so ehrlich es geht, damit wir diese Inhalte noch verbessern können.",,Gar nicht,Sehr gut,,,,,,
813,jRT6yzZ2ip5ab5ZFM,qFEyvypMn4sAwLwtc,EvalML-1-6,EvalML,12,93,True,surveySlider,,,,,,"Wie sehr hast du das Gefühl, verstanden zu haben, was der Unterschied zwischen überwachtem und unüberwachtem Lernen ist?",,Gar nicht,Sehr gut,,,,,,
814,jRT6yzZ2ip5ab5ZFM,qFEyvypMn4sAwLwtc,EvalML-1-7,EvalML,151,"Beim Maschinellem Lernen, wird die KI von einen Menschen treniert sachen zu tun ",True,freetext,correct,,,"{'content': 4, 'format': 2, 'creativity': 5}",,"Beschreib noch einmal in eigenen Worten, was maschinelles Lernen ist.",,,,,"Das maschinelle Lernen ist ein Teilbereich der KI. Er beschäftigt sich mit Programmen, die selbständig in großen Datenmengen Gesetzmäßigkeiten erkennen können. Solche Programme lernen anhand vieler Beispiele bzw. aus Erfahrung.",13.0,4.0,2.0,5.0
815,jRT6yzZ2ip5ab5ZFM,qFEyvypMn4sAwLwtc,EvalML-1-8,EvalML,52,"[True, False, True, True, False, True, True, True]",True,multipleChoice,false,"[[True, False, False, True, True, False, True, True], [True, False, False, True, True, False, True, True]]",,,,Welche der Aussagen über maschinelles Lernen stimmen?,"[{'de': 'Algorithmen des maschinellen Lernens können aus vorhandenen Daten selbständig lernen', 'en-US': 'Machine learning algorithms can learn autonomously from existing data'}, {'de': 'Beim überwachten Lernen nutzen wir Daten ohne Label', 'en-US': 'In supervised learning, we use data without a label'}, {'de': 'Beim unüberwachten Lernen versuchen wir, Strukturen in den Daten zu entdecken', 'en-US': 'In unsupervised learning, we try to discover structure in the data'}, {'de': 'Clustering ist ein Beispiel für unüberwachtes Lernen', 'en-US': 'Clustering is an example of unsupervised learning'}, {'de': 'Wenn wir für Daten Label vorhersagen wollen, betreiben wir Clustering', 'en-US': 'When we want to predict labels for data points, we engage in clustering'}, {'de': 'Wenn wir für Daten Label vorhersagen wollen, betreiben wir überwachtes Lernen', 'en-US': 'If we want to predict label for data, we do supervised learning'}, {'de': 'Algorithmen des maschinellen Lernens lernen nur, was in den Daten vorhanden ist. Daher ist die Auswahl an Trainingsdaten sehr wichtig', 'en-US': 'Machine learning algorithms only learn what is available in the data. Therefore, the selection of training data is very important'}, {'de': 'Algorithmen des maschinellen Lernens benötigen oft große Mengen an Daten, damit sie gute Ergebnisse erzielen', 'en-US': 'Machine learning algorithms often require large amounts of data to produce good results'}]",,,,"[True, False, True, True, False, True, True, True]",,,,
816,jRT6yzZ2ip5ab5ZFM,qFEyvypMn4sAwLwtc,EvalML-1-9,EvalML,29,"[True, True]",True,multipleChoice,correct,"[[True, False]]",,,,Welche Art des Lernens sind folgende Aufgaben?,"[{'de': 'Eine Webseite, die für neue Rezepte vorhersagt, ob sie dir “gefallen” oder “nicht gefallen”, ist eine Aufgabe für das überwachte Lernen', 'en-US': 'A website that predicts whether you will ""like"" or ""dislike"" new recipes is a task for supervised learning'}, {'de': 'Eine Webseite, die ähnliche Rezepte gruppiert, wäre eine Aufgabe für das Clustering', 'en-US': 'A website that groups similar recipes would be a task for clustering'}]",,,,"[True, True]",,,,
817,jRT6yzZ2ip5ab5ZFM,qFEyvypMn4sAwLwtc,Impact-1-1-1,Impact-1,18,"[False, True]",True,multipleChoice,correct,,,,,"Was glaubst du, warum das Gesicht der dunkelhäutigen Frau nicht erkannt wurde?","[{'de': 'Der Algorithmus wurde falsch programmiert', 'en-US': 'The algorithm was programmed incorrectly'}, {'de': 'Die Trainingsdaten, mit denen der Algorithmus gelernt hat, enthielten keine oder kaum Bilder von dunkelhäutigen Menschen', 'en-US': 'The training data with which the algorithm learned contained no or hardly any images of dark-skinned people'}]",,,,"[False, True]",,,,
818,jRT6yzZ2ip5ab5ZFM,qFEyvypMn4sAwLwtc,Impact-2-1-1,Impact-2,53,Man könnte damit verbrechen fälschen ,True,freetext,correct,,,"{'content': 4, 'format': 4, 'creativity': 4}",,Was für Probleme könnten durch den Einsatz von Deepfakes entstehen?,,,,,"Mögliche Probleme: Der Ruf und die Privatsphäre bestimmter Personen kann gezielt angegriffen werden. Meinungen können manipuliert werden. Es wird möglich, Videobeweisen leichter zu widersprechen.",5.0,4.0,4.0,4.0
819,jRT6yzZ2ip5ab5ZFM,qFEyvypMn4sAwLwtc,Impact-2-1-2,Impact-2,33,1,True,surveySlider,,,,,,"Ich würde gerne in einem Land leben, dass den Alltag aller Bürger mit KI überwacht.",,Stimme nicht zu,Stimme stark zu,,,,,,
820,jRT6yzZ2ip5ab5ZFM,qFEyvypMn4sAwLwtc,Impact-2-1-3,Impact-2,7,100,True,surveySlider,,,,,,Die Überwachung des Alltags aller Bürger sehe ich sehr kritisch.,,Stimme nicht zu,Stimme stark zu,,,,,,
821,jRT6yzZ2ip5ab5ZFM,qFEyvypMn4sAwLwtc,Impact-2-1-4,Impact-2,10,92,True,surveySlider,,,,,,"Mich würde es stören, mittels KI-Technologien überwacht zu werden.",,Stimme nicht zu,Stimme stark zu,,,,,,
822,jRT6yzZ2ip5ab5ZFM,qFEyvypMn4sAwLwtc,Impact-2-1-5,Impact-2,11,39,True,surveySlider,,,,,,Die Überwachung durch die Regierung bietet viele Vorteile für die Gesellschaft.,,Stimme nicht zu,Stimme stark zu,,,,,,
823,jRT6yzZ2ip5ab5ZFM,qFEyvypMn4sAwLwtc,Impact-2-1-6,Impact-2,7,100,True,surveySlider,,,,,,"Ich würde nicht in einem Land leben wollen, dass meinen Alltag überwacht.",,Stimme nicht zu,Stimme stark zu,,,,,,
824,jRT6yzZ2ip5ab5ZFM,qFEyvypMn4sAwLwtc,Impact-2-1-7,Impact-2,9,58,True,surveySlider,,,,,,In einem Land mit Überwachung würde ich mich sehr sicher fühlen.,,Stimme nicht zu,Stimme stark zu,,,,,,
825,jRT6yzZ2ip5ab5ZFM,qFEyvypMn4sAwLwtc,Impact-3-1-1,Impact-3,57,"[0, 1, 0, 1, 1, 0]",True,survey,,,,,,"Was glaubst du, welche Berufe relativ einfach von KI-Anwendungen übernommen werden können?","[{'de': 'Pflegepersonal', 'en-US': 'Care givers'}, {'de': 'LKW- und Taxifahrer', 'en-US': 'Truck and cab drivers'}, {'de': 'Wissenschaftler', 'en-US': 'Scientists'}, {'de': 'Angestellte bei einer Bank oder Versicherung', 'en-US': 'Employees at a bank or insurance company'}, {'de': 'Angestellte im Kundenservice', 'en-US': 'Customer service employees'}, {'de': 'Lehrer', 'en-US': 'Teacher'}]",,,,,,,,
826,jRT6yzZ2ip5ab5ZFM,qFEyvypMn4sAwLwtc,Impact-3-1-2,Impact-3,24,"[False, True, False, True, True, False]",True,multipleChoice,correct,,,,,Welche Jobs sind also bedroht?,"[{'de': 'Pflegepersonal', 'en-US': 'Care givers'}, {'de': 'LKW- und Taxifahrer', 'en-US': 'Truck and cab drivers'}, {'de': 'Wissenschaftler', 'en-US': 'Scientists'}, {'de': 'Angestellte bei einer Bank oder Versicherung', 'en-US': 'Employees at a bank or insurance company'}, {'de': 'Angestellte im Kundenservice', 'en-US': 'Customer service employees'}, {'de': 'Lehrer', 'en-US': 'Teacher'}]",,,"Kaum betroffen sind soziale Jobs und solche, die viel abstraktes Denken benötigen.","[False, True, False, True, True, False]",,,,
