395,hn2oJ5p2CwPfG44wx,qFEyvypMn4sAwLwtc,ML-2-1-1,ML-2,9,77,True,surveySlider,,,,,,"Wie gut weißt du schon, was Maschinelles Lernen ist?",,Gar nicht,Sehr gut,,,,,,
396,hn2oJ5p2CwPfG44wx,qFEyvypMn4sAwLwtc,ML-2-1-2,ML-2,786,"Maschinelles Lernen wird auch ""deep learning"" genannt. Dabei lernt das Computer durch Erfahrungen in einem bestimmten Bereich. Wenn man möchte das ein Computer Katzen erkennen kann, legt man ihm viele verschiedene Katzen Bilder vor. Dann erkennt er alle Ecken, Kanten und typische Formen, wie Nase, Ohren. Durch häufige Wiederholungen lernt der Computer dann, auch von anderen Bildern Katzen zu erkennen. ",True,freetext,correct,,,"{'content': 5, 'format': 5, 'creativity': 4}",,"Weißt du vielleicht schon etwas über das maschinelle Lernen? Es ist gar nicht schlimm, wenn das noch nicht der Fall ist. Dann schreib einfach, dass du noch nichts weißt.",,,,,"Das ist nur eine Abfrage, um über das Vorwissen der SuS bescheid zu wissen. Es ist nicht schlimm, wenn sie noch nichts wissen.",60.0,5.0,5.0,4.0
397,hn2oJ5p2CwPfG44wx,qFEyvypMn4sAwLwtc,ML-2-1-3,ML-2,109,"[True, False, True, True]",True,multipleChoice,correct,,,,,Lass uns das Wichtigste nochmal wiederholen:,"[{'de': 'Unser Ziel ist es, einen Algorithmus zu trainieren, der für neue Bilder das richtige Label vorhersagen kann. Also zu sagen, ob ein Bild einen Hund oder eine Katze zeigt', 'en-US': 'Our goal is to train an algorithm that can predict the correct label for new images. That is, to tell whether an image shows a dog or a cat'}, {'de': 'Für das Training nutzen wir Daten ohne Label', 'en-US': 'For training we use data without label'}, {'de': 'Die Daten, die wir für das Training benutzen, heißen Trainingsdaten', 'en-US': 'The data we use for training is called training data'}, {'de': 'Nach dem Training testen wir nochmal auf ein paar neuen Daten, wie gut die Vorhersagen des Algorithmus sind', 'en-US': 'After training, we test again on some new data how good the predictions of the algorithm are'}]",,,"Wenn du bei einer Antwort nicht weiter weißt, dann schau doch nochmal im Text nach.","[True, False, True, True]",,,,
398,hn2oJ5p2CwPfG44wx,qFEyvypMn4sAwLwtc,ML-3-1-1,ML-3,267,"[True, True, True, False]",True,multipleChoice,correct,"[[False, True, True, True], [False, True, True, False]]",1,,,Welche Aussagen stimmen?,"[{'de': 'Maschinelles Lernen ist ein Teilbereich der KI', 'en-US': 'Machine learning is a subfield of AI'}, {'de': 'Das maschinelle Lernen beschäftigt sich mit Programmen, die selbständig in großen Datenmengen Gesetzmäßigkeiten erkennen können', 'en-US': 'Machine learning deals with programs that can independently recognize regularities in large amounts of data'}, {'de': 'Das überwachte und das unüberwachte Lernen unterscheiden sich zum Beispiel daran, dass wir einmal Daten mit und einmal Daten ohne Label nutzen', 'en-US': 'One difference between supervised and unsupervised learning is whether we use labeled data'}, {'de': 'Beim unüberwachten Lernen wollen wir lernen, für neue Daten das richtige Label vorherzusagen', 'en-US': 'In unsupervised learning, we want to learn to predict the correct label for new data'}]",,,Lies die Antworten ganz genau durch.,"[True, True, True, False]",,,,
399,hn2oJ5p2CwPfG44wx,qFEyvypMn4sAwLwtc,ML-3-1-2,ML-3,31,"[True, False]",True,multipleChoice,correct,"[[False, True]]",,,,"Ein Empfehlungssystem für Musik, das lernt, was du für Musik magst und dann für neu erscheinende Musik voraussagt, ob du sie mögen würdest.","[{'de': 'Überwachtes Lernen', 'en-US': 'Supervised Learning'}, {'de': 'Unüberwachtes Lernen', 'en-US': 'Unsupervised Learning'}]",,,,"[True, False]",,,,
400,hn2oJ5p2CwPfG44wx,qFEyvypMn4sAwLwtc,ML-3-1-3,ML-3,20,"[True, False]",True,multipleChoice,correct,"[[False, True]]",,,,"Die Gesichtserkennung von deinem Handy. Anfangs musst du dein Gesicht aus verschiedenen Winkeln filmen. Anhand dieser Beispiele lernt es, dein Gesicht zu erkennen. Wenn dann irgendein Gesicht versucht, dein Handy zu entsperren, kann es voraussagen, ob es dein Gesicht ist oder nicht.","[{'de': 'Überwachtes Lernen', 'en-US': 'Supervised Learning'}, {'de': 'Unüberwachtes Lernen', 'en-US': 'Unsupervised Learning'}]",,,,"[True, False]",,,,
401,hn2oJ5p2CwPfG44wx,qFEyvypMn4sAwLwtc,ML-3-1-4,ML-3,8,"[False, True]",True,multipleChoice,correct,,,,,Wenn wir Youtuber nach der Anzahl ihrer Follower und der Themen ihrer Videos gruppieren.,"[{'de': 'Überwachtes Lernen', 'en-US': 'Supervised Learning'}, {'de': 'Unüberwachtes Lernen', 'en-US': 'Unsupervised Learning'}]",,,,"[False, True]",,,,
402,hn2oJ5p2CwPfG44wx,qFEyvypMn4sAwLwtc,Classification-1-1-1,Classification-1,28,"[False, True, False]",True,multipleChoice,correct,,,,,Welche Aussagen stimmen?,"[{'de': 'Beim überwachten Lernen braucht man Daten ohne Label', 'en-US': 'In supervised learning, you need data without a label'}, {'de': 'Einen Algorithmus zu trainieren, der Bildern mit Hunden das Label “Hund” gibt, wäre ein Fall für überwachtes Lernen', 'en-US': 'Training an algorithm to give the label ""dog"" to images with dogs would be a case for supervised learning'}, {'de': 'Beim überwachten Lernen versucht man Struktur in Daten zu finden', 'en-US': 'In supervised learning, one tries to find structure in data'}]",,,Lies die Antworten ganz genau.,"[False, True, False]",,,,
403,hn2oJ5p2CwPfG44wx,qFEyvypMn4sAwLwtc,Clustering-1-1-1,Clustering-1,26,"[False, False, True, True]",True,multipleChoice,correct,,,,,Was war unüberwachtes Lernen noch gleich?,"[{'de': 'Beim unüberwachten Lernen nutzt man Daten mit Label', 'en-US': 'In unsupervised learning, one uses data with label'}, {'de': 'Beim unüberwachten Lernen wollen wir die richtigen Label für neue Daten vorhersagen', 'en-US': 'In unsupervised learning, we want to predict the correct labels for new data'}, {'de': 'Beim unüberwachten Lernen hat man keine Label für die Daten', 'en-US': ""In unsupervised learning, you don't have a label for the data""}, {'de': 'Beim unüberwachten Lernen geht es darum, Struktur in den Daten zu finden', 'en-US': 'Unsupervised learning is about finding structure in the data'}]",,,Hier geht es nicht um überwachtes Lernen!,"[False, False, True, True]",,,,
404,hn2oJ5p2CwPfG44wx,qFEyvypMn4sAwLwtc,Clustering-1-1-2,Clustering-1,74,"[True, False]",True,multipleChoice,correct,,,,,Welche Aussagen über die anderen beiden Cluster stimmen?,"[{'de': 'Die Youtuber im roten Cluster laden öfter Videos hoch', 'en-US': 'The Youtubers in the red cluster upload videos more often'}, {'de': 'Die Youtuber im blauen Cluster laden öfter Videos hoch', 'en-US': 'The Youtubers in the blue cluster upload videos more often'}]",,,,"[True, False]",,,,
405,hn2oJ5p2CwPfG44wx,qFEyvypMn4sAwLwtc,Clustering-1-1-3,Clustering-1,142,8,True,inputField,correct,['3'],1,,,Wie viele Youtuber sind sowohl sehr aktiv als auch beliebt?,,,,In welchem Cluster sind die beliebtesten und aktivsten Youtuber?,8,,,,
406,hn2oJ5p2CwPfG44wx,qFEyvypMn4sAwLwtc,Clustering-1-1-4,Clustering-1,56,7,True,inputField,correct,,1,,,"Wie viele Youtuber sind aktiv, haben aber nicht so viele Views?",,,,"Welche Gruppe hat viele Uploads, aber nicht so viele Views? Wie viele Youtuber sind in diesem Cluster?",7,,,,
407,hn2oJ5p2CwPfG44wx,qFEyvypMn4sAwLwtc,Classification-2-1-1,Classification-2,68,1,True,inputField,correct,,,,,Wie viele Filme stimmen zwischen Josi und Alex überein? Gib die Zahl in dieses Feld ein.,,,,,1,,,,
408,hn2oJ5p2CwPfG44wx,qFEyvypMn4sAwLwtc,Classification-2-1-2,Classification-2,13,1,True,inputField,correct,,,,,Wie viele Filme stimmen zwischen Paul und Alex überein?,,,,,1,,,,
409,hn2oJ5p2CwPfG44wx,qFEyvypMn4sAwLwtc,Classification-2-1-3,Classification-2,13,3,True,inputField,correct,,,,,Wie viele Filme stimmen zwischen Mahmud und Alex überein?,,,,,3,,,,
410,hn2oJ5p2CwPfG44wx,qFEyvypMn4sAwLwtc,Classification-2-1-4,Classification-2,18,1,True,inputField,correct,,,,,Wie viele Filme stimmen zwischen Anna und Alex überein?,,,,,1,,,,
411,hn2oJ5p2CwPfG44wx,qFEyvypMn4sAwLwtc,Classification-2-1-5,Classification-2,42,1,True,inputField,correct,,,,,Wie viele Filme stimmen zwischen Isa und Alex überein?,,,,,1,,,,
412,hn2oJ5p2CwPfG44wx,qFEyvypMn4sAwLwtc,Classification-2-1-6,Classification-2,14,"[False, False, True, False, False]",True,multipleChoice,correct,,,,,Wer hat den ähnlichsten Filmgeschmack zu Alex?,"[{'de': 'Josi', 'en-US': 'Josi'}, {'de': 'Paul', 'en-US': 'Paul'}, {'de': 'Mahmud', 'en-US': 'Mahmud'}, {'de': 'Anna', 'en-US': 'Anna'}, {'de': 'Isa', 'en-US': 'Isa'}]",,,Wer hatte die meisten Übereinstimmungen mit Alex?,"[False, False, True, False, False]",,,,
413,hn2oJ5p2CwPfG44wx,qFEyvypMn4sAwLwtc,Classification-2-1-7,Classification-2,14,"[False, False, True, False, False]",True,multipleChoice,correct,,,,,Welchen Film kannst du Alex guten Gewissens empfehlen?,"[{'de': 'James Bond', 'en-US': 'James Bond'}, {'de': 'Herr der Ringe', 'en-US': 'Lord of the Rings'}, {'de': 'Avengers Endgame', 'en-US': 'Avengers Endgame'}, {'de': 'Fluch der Karibik', 'en-US': 'Pirates of the Caribbean'}, {'de': 'Hangover', 'en-US': 'Hangover'}]",,,Welchen Film hat Mahmud zuletzt geschaut?,"[False, False, True, False, False]",,,,
414,hn2oJ5p2CwPfG44wx,qFEyvypMn4sAwLwtc,Classification-2-1-8,Classification-2,24,"[True, False, True]",True,multipleChoice,correct,,,,,Welche Aussagen stimmen?,"[{'de': 'Ein Algorithmus, der dir basierend auf deinen Lieblingsfächern einen Beruf vorschlägt, könnte man mittels überwachtem Lernen umsetzen', 'en-US': 'An algorithm that suggests a profession based on your favorite subjects could be implemented using supervised learning'}, {'de': 'Ein Algorithmus, der ähnliche Berufe gruppiert, gehört zum überwachten Lernen', 'en-US': 'An algorithm that groups similar occupations is part of supervised learning'}, {'de': 'Ein Algorithmus, der anhand vieler alter Fälle gelernt hat, medizinische Diagnosen zu stellen, gehört zum überwachten Lernen', 'en-US': 'An algorithm that has learned to make medical diagnoses based on many old cases is part of supervised learning'}]",,,"Denk daran, dass wir beim überwachten Lernen Label voraussagen. Welcher dieser Algorithmen sagt ein Label voraus?","[True, False, True]",,,,
415,hn2oJ5p2CwPfG44wx,qFEyvypMn4sAwLwtc,Clustering-2-1-1,Clustering-2,770,"Das Beauty, Vlogs repräsentiert am ehesten eine Make-Up-Marke, da es da ohnehin schon mehr um so etwas wie Make-up geht. Außerdem sind die meisten Zuschauer Frauen und da Make-up meist etwas für Frauen ist, passt es.Und die Zuschauer von dem Cluster Kindererziehung, Geldanlage würden am ehesten Autos kaufen, da Leute in großen Familien meistens Autos brauchen. Außerdem passen Autos auch noch für Leute, die sich für Geldanlage interessieren, da sie sich meistens Autos leisten können.",True,freetext,correct,,,"{'content': 4, 'format': 5, 'creativity': 4}",,"Schau dir die Mittelpunkte der Cluster genau an. Welches Cluster repräsentiert am ehesten eine Make-Up-Marke? Und die Zuschauer welches Clusters würden am ehesten Autos kaufen? Beschreibe in 4-5 Sätzen, welche Cluster du jeweils gewählt hast und warum diese Youtuber die perfekten Markenbotschafter dafür wären.",,,,,"Make-Up: Cluster 1 repräsentiert es am besten. Ist bereits Thema und die Zuschauer sind die richtig Zielgruppe. Autos: Cluster 3-6 wären alle alt genug. Alle wären möglich, käme auf das Auto an. Cluster 4 zB eher Familienautos, 5 und 6 eher günstige Kleinwagen und Cluster 3 auch teurere Autos.",75.0,4.0,5.0,4.0
416,hn2oJ5p2CwPfG44wx,qFEyvypMn4sAwLwtc,LimitsML-1-1,LimitsML,41,"[True, True, False]",True,multipleChoice,correct,,,,,"Was könnte passieren, wenn wir bei den Hundebildern nur Bilder von einer Hunderasse nutzen würden?","[{'de': 'Der Algorithmus würde nur Hunde dieser Rasse zuverlässig als Hunde erkennen', 'en-US': 'The algorithm would only reliably recognize dogs of this breed as dogs'}, {'de': 'Bei Hunden anderer Rassen ist es schwer zu sagen, ob er sie erkennen würde, aber sehr wahrscheinlich nicht so zuverlässig', 'en-US': ""With other breed dogs, it's hard to say if he would recognize them, but most likely not as reliably""}, {'de': 'Der Algorithmus würde immer noch alle Hunderassen als Hunde erkennen, weil es keine Katzen sind', 'en-US': 'The algorithm would still recognize all dog breeds as dogs because they are not cats'}]",,,,"[True, True, False]",,,,
417,hn2oJ5p2CwPfG44wx,qFEyvypMn4sAwLwtc,LimitsML-1-2,LimitsML,87,"Dann würde das Algorithmus nur Seehunde als Hunde ansehen, echte Hunde jedoch nicht.",True,freetext,correct,,,"{'content': 5, 'format': 5, 'creativity': 5}",,"Was würde passieren, wenn wir alle Bilder von Hunden durch Bilder von Seehunden ersetzen würden, diese aber als Hunde labeln?",,,,,"Der Algorithmus würde lernen, Seehunde auf unseren Bildern zu erkennen, ihnen aber das Label “Hund” geben.",13.0,5.0,5.0,5.0
418,hn2oJ5p2CwPfG44wx,qFEyvypMn4sAwLwtc,EvalML-1-1,EvalML,8,79,True,surveySlider,,,,,,"Wie gut hast du verstanden, was KI ist? Sei dabei so ehrlich es geht damit wir diese Inhalte noch verbessern können.",,Gar nicht,Sehr gut,,,,,,
419,hn2oJ5p2CwPfG44wx,qFEyvypMn4sAwLwtc,EvalML-1-2,EvalML,8,84,True,surveySlider,,,,,,Wie gut hast du den Unterschied zwischen spezifischer und allgemeiner KI verstanden?,,Gar nicht,Sehr gut,,,,,,
420,hn2oJ5p2CwPfG44wx,qFEyvypMn4sAwLwtc,EvalML-1-3,EvalML,107,"[True, False, False, True, False, True, False, False, True]",True,multipleChoice,false,"[[True, True, False, True, False, True, False, False, True]]",,,,Welche der Aussagen stimmen?,"[{'de': 'KI-Anwendungen zeichnen sich dadurch aus, dass sie intelligentes Verhalten zeigen, autonom funktionieren und mit Erfahrung lernen', 'en-US': 'AI applications are characterized by exhibiting intelligent behavior, functioning autonomously, and learning with experience'}, {'de': 'Eine fertige KI-Anwendung kann nicht ohne Hilfe von einem Menschen funktionieren', 'en-US': 'A finished AI application cannot function without help from a human'}, {'de': 'Eine fertige KI-Anwendung kann nicht mit Erfahrung lernen, sie bleibt, wie sie ist', 'en-US': 'A ready-made AI application cannot learn with experience, it remains as it is'}, {'de': 'Eine spezifische KI zeigt intelligentes Verhalten in einem kleinen Bereich', 'en-US': 'A specific AI exhibits intelligent behavior in a small domain'}, {'de': 'Jede KI hat allgemeine Intelligenz. Damit ist jede KI eine allgemeine KI', 'en-US': 'Every AI has general intelligence. Thus every AI is a general AI'}, {'de': 'Ein Programm, dass so gut Schach spielen kann, wie Menschen, ist ein Beispiel für eine spezifische KI', 'en-US': 'A program that can play chess as well as humans is an example of a specific AI'}, {'de': 'Derzeit gibt es sowohl Anwendungen, die zur spezifischen, als auch welche, die zur allgemeinen KI gehören', 'en-US': 'Currently, there are applications that belong to specific AI as well as those that belong to general AI'}, {'de': 'KI kann irgendwann alles besser als der Mensch', 'en-US': 'AI will eventually be able to do everything better than humans'}, {'de': 'Jeder Mensch wird zukünftig eine Vielzahl verschiedener KIs in seinem Alltag nutzen', 'en-US': 'In the future, everyone will use a variety of different AIs in their everyday lives'}]",,,,"[True, False, False, True, False, True, False, False, True]",,,,
421,hn2oJ5p2CwPfG44wx,qFEyvypMn4sAwLwtc,EvalML-1-4,EvalML,50,"[True, False, True, False]",True,multipleChoice,correct,,1,,,Welche der folgenden Anwendungen enthalten KI-Methoden?,"[{'de': 'Die Erkennung von Gegenständen auf Bildern', 'en-US': 'The recognition of objects in images'}, {'de': 'Das Sortieren von Bildern nach Datum', 'en-US': 'Sorting images by date'}, {'de': 'Ein personalisiertes Empfehlungssystem für Musik', 'en-US': 'A personalized recommendation system for music'}, {'de': 'Eine Nachrichtenseite, die jedem Nutzer den gleichen Inhalt präsentiert', 'en-US': 'A news site that presents the same content to every user'}]",,,"Denk an die drei Eigenschaften, die KI-Anwendungen ausmachen: intelligentes Verhalten, Lernen mit Erfahrung und Selbständigkeit.","[True, False, True, False]",,,,
422,hn2oJ5p2CwPfG44wx,qFEyvypMn4sAwLwtc,EvalML-1-5,EvalML,12,100,True,surveySlider,,,,,,"Wie gut hast du verstanden, was maschinelles Lernen ist? Sei dabei so ehrlich es geht, damit wir diese Inhalte noch verbessern können.",,Gar nicht,Sehr gut,,,,,,
423,hn2oJ5p2CwPfG44wx,qFEyvypMn4sAwLwtc,EvalML-1-6,EvalML,11,100,True,surveySlider,,,,,,"Wie sehr hast du das Gefühl, verstanden zu haben, was der Unterschied zwischen überwachtem und unüberwachtem Lernen ist?",,Gar nicht,Sehr gut,,,,,,
424,hn2oJ5p2CwPfG44wx,qFEyvypMn4sAwLwtc,EvalML-1-7,EvalML,372,"Maschinelles Lernen ist Lernen durch Erfahrungen. Dabei werden Algorithmen zum Beispiel viele verschiedene Bilder mit bestimmten Objekten oder Lebewesen vorgelegt, damit es lernt auch von anderen Bildern sie zu erkennen. ",True,freetext,correct,,,"{'content': 5, 'format': 5, 'creativity': 3}",,"Beschreib noch einmal in eigenen Worten, was maschinelles Lernen ist.",,,,,"Das maschinelle Lernen ist ein Teilbereich der KI. Er beschäftigt sich mit Programmen, die selbständig in großen Datenmengen Gesetzmäßigkeiten erkennen können. Solche Programme lernen anhand vieler Beispiele bzw. aus Erfahrung.",30.0,5.0,5.0,3.0
425,hn2oJ5p2CwPfG44wx,qFEyvypMn4sAwLwtc,EvalML-1-8,EvalML,162,"[True, False, True, True, False, True, True, True]",True,multipleChoice,false,"[[False, True, True, True, False, True, True, True]]",,,,Welche der Aussagen über maschinelles Lernen stimmen?,"[{'de': 'Algorithmen des maschinellen Lernens können aus vorhandenen Daten selbständig lernen', 'en-US': 'Machine learning algorithms can learn autonomously from existing data'}, {'de': 'Beim überwachten Lernen nutzen wir Daten ohne Label', 'en-US': 'In supervised learning, we use data without a label'}, {'de': 'Beim unüberwachten Lernen versuchen wir, Strukturen in den Daten zu entdecken', 'en-US': 'In unsupervised learning, we try to discover structure in the data'}, {'de': 'Clustering ist ein Beispiel für unüberwachtes Lernen', 'en-US': 'Clustering is an example of unsupervised learning'}, {'de': 'Wenn wir für Daten Label vorhersagen wollen, betreiben wir Clustering', 'en-US': 'When we want to predict labels for data points, we engage in clustering'}, {'de': 'Wenn wir für Daten Label vorhersagen wollen, betreiben wir überwachtes Lernen', 'en-US': 'If we want to predict label for data, we do supervised learning'}, {'de': 'Algorithmen des maschinellen Lernens lernen nur, was in den Daten vorhanden ist. Daher ist die Auswahl an Trainingsdaten sehr wichtig', 'en-US': 'Machine learning algorithms only learn what is available in the data. Therefore, the selection of training data is very important'}, {'de': 'Algorithmen des maschinellen Lernens benötigen oft große Mengen an Daten, damit sie gute Ergebnisse erzielen', 'en-US': 'Machine learning algorithms often require large amounts of data to produce good results'}]",,,,"[True, False, True, True, False, True, True, True]",,,,
426,hn2oJ5p2CwPfG44wx,qFEyvypMn4sAwLwtc,EvalML-1-9,EvalML,29,"[True, True]",True,multipleChoice,correct,,,,,Welche Art des Lernens sind folgende Aufgaben?,"[{'de': 'Eine Webseite, die für neue Rezepte vorhersagt, ob sie dir “gefallen” oder “nicht gefallen”, ist eine Aufgabe für das überwachte Lernen', 'en-US': 'A website that predicts whether you will ""like"" or ""dislike"" new recipes is a task for supervised learning'}, {'de': 'Eine Webseite, die ähnliche Rezepte gruppiert, wäre eine Aufgabe für das Clustering', 'en-US': 'A website that groups similar recipes would be a task for clustering'}]",,,,"[True, True]",,,,
427,hn2oJ5p2CwPfG44wx,qFEyvypMn4sAwLwtc,Impact-1-1-1,Impact-1,76,"[False, True]",True,multipleChoice,correct,,,,,"Was glaubst du, warum das Gesicht der dunkelhäutigen Frau nicht erkannt wurde?","[{'de': 'Der Algorithmus wurde falsch programmiert', 'en-US': 'The algorithm was programmed incorrectly'}, {'de': 'Die Trainingsdaten, mit denen der Algorithmus gelernt hat, enthielten keine oder kaum Bilder von dunkelhäutigen Menschen', 'en-US': 'The training data with which the algorithm learned contained no or hardly any images of dark-skinned people'}]",,,,"[False, True]",,,,
428,hn2oJ5p2CwPfG44wx,qFEyvypMn4sAwLwtc,Impact-2-1-1,Impact-2,401,"Man könnte Videos hochladen, die nie passiert sind. Dann werden die Personen für etwas beschuldigt das nie passiert ist. Außerdem könnte man das Videomaterial von Überwachungskameras sabotieren. Dann könnten Verbrecher davon kommen und sogar unschuldige Verhaftet werden.",True,freetext,correct,,,"{'content': 4, 'format': 4, 'creativity': 4}",,Was für Probleme könnten durch den Einsatz von Deepfakes entstehen?,,,,,"Mögliche Probleme: Der Ruf und die Privatsphäre bestimmter Personen kann gezielt angegriffen werden. Meinungen können manipuliert werden. Es wird möglich, Videobeweisen leichter zu widersprechen.",37.0,4.0,4.0,4.0
429,hn2oJ5p2CwPfG44wx,qFEyvypMn4sAwLwtc,Impact-2-1-2,Impact-2,119,24,True,surveySlider,,,,,,"Ich würde gerne in einem Land leben, dass den Alltag aller Bürger mit KI überwacht.",,Stimme nicht zu,Stimme stark zu,,,,,,
430,hn2oJ5p2CwPfG44wx,qFEyvypMn4sAwLwtc,Impact-2-1-3,Impact-2,21,79,True,surveySlider,,,,,,Die Überwachung des Alltags aller Bürger sehe ich sehr kritisch.,,Stimme nicht zu,Stimme stark zu,,,,,,
431,hn2oJ5p2CwPfG44wx,qFEyvypMn4sAwLwtc,Impact-2-1-4,Impact-2,8,80,True,surveySlider,,,,,,"Mich würde es stören, mittels KI-Technologien überwacht zu werden.",,Stimme nicht zu,Stimme stark zu,,,,,,
432,hn2oJ5p2CwPfG44wx,qFEyvypMn4sAwLwtc,Impact-2-1-5,Impact-2,24,25,True,surveySlider,,,,,,Die Überwachung durch die Regierung bietet viele Vorteile für die Gesellschaft.,,Stimme nicht zu,Stimme stark zu,,,,,,
433,hn2oJ5p2CwPfG44wx,qFEyvypMn4sAwLwtc,Impact-2-1-6,Impact-2,7,84,True,surveySlider,,,,,,"Ich würde nicht in einem Land leben wollen, dass meinen Alltag überwacht.",,Stimme nicht zu,Stimme stark zu,,,,,,
434,hn2oJ5p2CwPfG44wx,qFEyvypMn4sAwLwtc,Impact-2-1-7,Impact-2,8,19,True,surveySlider,,,,,,In einem Land mit Überwachung würde ich mich sehr sicher fühlen.,,Stimme nicht zu,Stimme stark zu,,,,,,
435,dotjrftFetJme4iPH,qFEyvypMn4sAwLwtc,AI-1-v2-1-1,AI-1-v2,47,76,True,surveySlider,,,,,,"Wie gut weißt du schon, was KI ist?",,Gar nicht,Sehr gut,,,,,,
436,dotjrftFetJme4iPH,qFEyvypMn4sAwLwtc,AI-1-v2-1-2,AI-1-v2,1063,"Meiner Meinung nach, künstliche Intelligenz ist das „Deep–Learning“, welches den Maschinen ermöglicht, das menschliche Denken nachzuahmen. Das sogenannte „Deep–Learning“ ist ein Prozess, wobei die Maschinen Bilder nach ihrer Pixel Auflösung und nach Kategorie analysieren.",True,freetext,correct,,,"{'content': 4, 'format': 5, 'creativity': 4}",,"Was ist deiner Meinung nach Künstliche Intelligenz? Es ist gar nicht schlimm, wenn du dir nicht ganz sicher bist. Du bist ja hier, um es zu lernen. Schreib einfach alles auf, was du über sie weißt oder denkst. Bei solchen Aufgaben, kriegt deine Lehrkraft deine abgegebene Antwort immer zugeschickt, um sie bewerten zu können. ",,,,,"Die Schülerinnen und Schüler (SuS) sollen beschreiben, was sie schon über KI wissen. Es ist nicht schlimm, wenn sie noch nichts wissen.",34.0,4.0,5.0,4.0
437,dotjrftFetJme4iPH,qFEyvypMn4sAwLwtc,AI-1-v2-2-1,AI-1-v2,382,"[0, 0, 0, 1, 0]",True,survey,,,,,,"Wie viele deiner Zeichnungen hat die KI erkannt? Keine Sorge, das hier ist eine Umfrage, dabei gibt es keine richtigen oder falschen Antworten. Umfragen sind anonym, du kannst also einfach anklicken, was auf dich zutrifft. Danach siehst du, wie viele der anderen in deiner Klasse, welche Option gewählt haben.","[{'de': '0', 'en-US': '0'}, {'de': '1-2', 'en-US': '1-2.'}, {'de': '3-4', 'en-US': '3-4'}, {'de': '5-6', 'en-US': '5-6'}]",,,,,,,,
438,dotjrftFetJme4iPH,qFEyvypMn4sAwLwtc,AI-2-v2-1-1,AI-2-v2,70,"[True, True, False, True]",True,multipleChoice,correct,,,,,"Kannst du erkennen, wo KI überall drin steckt? Denke dabei an die Eigenschaften, die alle KI-Anwendungen verbindet. Bei Multiple-Choice Aufgaben, neben denen “Mehrfachauswahl” steht, können mehrere Antworten richtig sein. Wähle alle richtigen Antworten aus. Wenn du mal nicht weiter weißt, kannst du dir auch einen Tipp holen.","[{'de': 'Der Newsfeed eines Social Network nutzt KI', 'en-US': 'The newsfeed of a social network uses AI'}, {'de': 'Die Personalisierung einer Google-Anfrage nutzt KI', 'en-US': 'The personalization of a Google query uses AI'}, {'de': 'Die Startseite einer Webseite, die jedem Besucher die gleichen Inhalte anzeigt nutzt KI', 'en-US': 'The home page of a website that displays the same content to every visitor uses AI'}, {'de': 'Gesichtserkennung nutzt KI', 'en-US': 'Face recognition uses AI'}]",,,"Denk an die Beispiele, die wir uns am Anfang angeschaut haben. Wenn du es immer noch nicht weißt, ist das nicht schlimm, dann zeigen wir dir die Lösung. Damit du aber auch wirklich etwas lernst, musst du diese eine Aufgabe dann später nochmal machen.","[True, True, False, True]",,,,
439,dotjrftFetJme4iPH,qFEyvypMn4sAwLwtc,AI-3-v2-1-1,AI-3-v2,128,"[False, False, False]",True,multipleChoice,false,"[[True, True, False], [True, True, False], [True, True, False], [False, True, False]]",1,,,Was für Sachen können KI-Anwendungen?,"[{'de': 'Die Anwendung, die den Facebook-Feed erstellt, kann auch Schach spielen', 'en-US': 'The application that creates the Facebook feed can also play chess'}, {'de': 'Das Programm zur Gesichtserkennung auf deinem Handy kann auch Auto fahren', 'en-US': 'The face recognition program on your phone can also drive a car'}, {'de': 'Eine Sprachsteuerung wie Siri oder Alexa kann auch Gesichter erkennen', 'en-US': 'A voice control like Siri or Alexa can also recognize faces'}]",,,"Kann überhaupt eine dieser Anwendungen etwas, für das sie nicht programmiert wurde?","[False, False, False]",,,,
